headline,source
Big Tech’s big problem is also its ‘best-kept secret’: Caste discrimination,NBC
"The best coffee makers of 2026, approved by experts and coffee enthusiasts",NBC
,
Israel again orders residents to evacuate areas of Gaza City it once said were cleared of Hamas,NBC
Jan. 6 rioter who Tucker Carlson guest said was a fed is arrested by the FBI,NBC
Liberal justices say Trump immunity decision 'will have disastrous consequences' for the U.S.,NBC
Stateside Puerto Ricans demand answers on unused hurricane aid to Puerto Rico,NBC
Trump plays attack dog for Bernie Moreno as Ohio's GOP Senate primary ends on a vicious note,NBC
Guardians stun Yankees on walk-off home run in extra innings,NBC
Israeli war’s latest phase may reckon with tension between dismantling Hamas and rescuing hostages,NBC
The politics of tariffs are complicated. A Democrat just introduced a bill to make Trump's proposals law.,NBC
U.S. and Israel launch a massive joint military exercise to send a message to Iran and others,NBC
U.N. peacekeepers in Lebanon pledge not to give in to Israeli demands to 'get out of harm's way',NBC
The simple reason Kamala Harris is on The Shade Room,NBC
A Trump employee told the FBI that the former president ordered staff to move boxes of documents at Mar-a-Lago,NBC
What to buy (and skip) during Prime Day 2024,NBC
"Far from the convention, a Democrat runs from Harris and hands out beer in rural Maine",NBC
"Iran is helping the Houthi rebels in Yemen target and down U.S. Reaper drones, U.S. officials say",NBC
Yemen’s Houthi rebels target ship in the Gulf of Aden as the Eisenhower aircraft carrier heads home ,NBC
Inside the Christian TV show rallying Trump superfans with apocalyptic warnings,NBC
Trump campaign scrambles over abortion ban report as Democrats seize the moment,NBC
21+ best gifts for new parents to make life easier,NBC
Dozens killed as '4 schools in the last 4 days' struck in Gaza,NBC
Trump supporter who called Capitol cops 'weasels' on Jan. 6 sentenced to prison,NBC
Texas woman arrested and charged with threatening federal judge overseeing Trump’s election case,NBC
Tom Brady and partner Tom Wagner to pay over $200 million for stake in Las Vegas Raiders,NBC
How to identify and take care of your curl type — and why it matters,NBC
Former NFL QB Jay Cutler arrested on charges of DUI and gun possession after minor crash in Tennessee,NBC
The reality of Trump and Stefanik's Jan. 6 'hostages',NBC
Pence: Idea of overturning election results is 'un-American',NBC
FDA authorizes Novavax's updated Covid vaccine,NBC
Jan. 6 panel adds last-minute hearing Tuesday afternoon,NBC
"The best products for acne-prone skin, recommended by dermatologists",NBC
A tense new Jan. 6 video shows Republican congressmen admonishing rioters trying to enter House chamber,NBC
Israel withdrawing some units from Gaza,NBC
"From a 'wake' to 'Mardi Gras': With Harris, the Democratic convention is a hot ticket ",NBC
"After election setbacks, Narendra Modi's image in the U.S. is more important than ever",NBC
Inside the right’s effort to build a voter fraud hunting tool,NBC
Arizona certifies abortion-rights initiative for the November ballot,NBC
Netanyahu government makes West Bank settlement its expansion top priority,NBC
"G20 showcases India's growing global clout, as well as worries over press freedom",NBC
North Korea's Kim Jong Un wants to speed up becoming a nuclear superpower,NBC
Doctors and patients fearfully proceed with IVF after Alabama court rules embryos are children,NBC
Father hails ‘miracle’ daughters who were pulled from rubble after Israeli strike,NBC
"Select Pet Awards 2023: The best grooming, travel and tech products for dogs and cats",NBC
"Best sleep gear from Boll & Branch, Bearaby and more: Select Wellness Awards 2023",NBC
17 hostages released in second group amid temporary cease-fire in Gaza,NBC
Who invented butter chicken? A court in India will decide.,NBC
Chinese farmers hit by floods and drought say extreme weather is getting worse ,NBC
Hezbollah head vows vengeance over killing of Hamas leader in Iran ,NBC
'Dead heat': Trump pulls even with Harris in NBC News poll,NBC
Barack Obama cuts new ads in major Senate races,NBC
"Black men shift slightly toward Trump in record numbers, polls show",NBC
Gaza struggles to bury and grieve the dead in accordance with Islamic traditions,NBC
"Bullet found near bodies of 2 Indiana teens in Delphi killings linked to suspect’s gun, officials say ",NBC
Biden speaks with Netanyahu as tensions over the Israel-Hamas war mount in the US,NBC
Vance says Trump didn't lose the 2020 election: 'Not by the words I would use',NBC
Israel says it killed a top Hezbollah official in 'targeted' Beirut strike after group vowed revenge for device blasts,NBC
Harris rattles 'angry' Trump in debate as both candidates seek mantle of change,NBC
"CVS replaces CEO as profits, share price suffer  ",NBC
"Top-rated travel diffusers for smooth, defined curls whenever, wherever",NBC
Class Destroyed,NBC
Far-right election denier Mastriano wins GOP race for governor in Pennsylvania,NBC
U.S. and Microsoft seize more than 100 websites alleged to have been part of Russian espionage campaign,NBC
Republican National Committee prepares for a convention Trump may not attend,NBC
Iran launches retaliatory attack on Israel that risks sparking regional war,NBC
Biden privately remains torn between defiance and acceptance amid calls to step aside ,NBC
Special counsel charges Trump with conspiracy to defraud the U.S. ,NBC
Meta says it broke up Chinese influence operation looking to exploit U.S. political divisions,NBC
Former Hungarian insider releases audio he says is proof of corruption in embattled Orbán government,NBC
"The best hair dryers for every hair type, approved by editors and experts",NBC
Microplastics found in fresh snow on Antarctica,NBC
"Arrested after a fatal stabbing, a Utah man told police he brought a gun to Capitol riot",NBC
U.S. warns Israel has no plan to eliminate Hamas as IDF battles regrouped militants in northern Gaza,NBC
Israel and Hamas reach deal to release 50 hostages and pause fighting for 4 days in Gaza,NBC
"Battles rage across Gaza as death toll tops 35,000 and tens of thousands evacuate Rafah",NBC
"'Batwoman' casts Black, bisexual actress Javicia Leslie to play superhero",NBC
Pence heckled at conservative event with shouts of 'traitor',NBC
Cease-fire talks advance in Egypt even as Israel threatens to invade Rafah,NBC
"Putin pledges truce if Ukraine exits Russian-occupied areas and drops NATO bid, nonstarters for Kyiv",NBC
Israel launches invasion into southern Lebanon targeting Hezbollah,NBC
'Shogun' breaks record with 18 Emmy wins,NBC
Top Israeli legal official tells Netanyahu to fire key ally after Supreme Court ruling,NBC
Israeli ultranationalist minister visits flashpoint Jerusalem holy site  ,NBC
"Harris pitches plans to tackle food, housing, medicine and child care costs in N.C. speech",NBC
Defense Secretary Lloyd Austin resumes duty after undergoing procedure at Walter Reed,NBC
DNC 2024 highlights: Biden passes torch to Harris in Democratic convention speech,NBC
"Palestinian support for ‘armed struggle’ is rising as Gaza death estimate tops 20,000",NBC
U.S. and Qatar agree not to release Iran's $6B ,NBC
Social media users are collectively blocking celebrities and influencers who have been silent on Gaza,NBC
"Looking for leads, not love: Job seekers in China turn Tinder into a networking tool",NBC
"California man accused of drugging, sexually assaulting nine women is charged with murder",NBC
"19 best workout leggings, tested by experts and editors",NBC
"Zelenskyy calls for international support, Harris underscores unity with Ukraine",NBC
Ex-cop who stormed the Capitol on Jan. 6 sentenced to record-tying 7 years in prison,NBC
"No new talks over U.S. soldier detained in North Korea, U.S. officials say",NBC
GOP-led House committees release lengthy report alleging President Biden committed impeachable offenses,NBC
Putin warns he could provide weapons to attack the West and issues new nuclear threat,NBC
Israel’s outgoing army chief rebukes Netanyahu's far-right government ,NBC
Trump comes out against Florida's abortion rights ballot measure after conservative backlash,NBC
Kanye West implies he plans to vote for Donald Trump in 2020,NBC
Palestinian civilians trapped in Gaza amid intensifying Israeli bombing,NBC
Congress passes bill to boost presidential candidate security after apparent attempt on Trump's life,NBC
Harris points to California experience and criticizes Trump when asked how she would differ from Biden on border policy,NBC
Hard-liner Raisi's 'engineered' Iran election win entrenches conservative rule,NBC
Tens of thousands protest Netanyahu's contentious plan to overhaul Israel's judicial system,NBC
Police deny Venezuela gang has taken over rundown apartment complex in Denver suburb,NBC
Israel says ground operation at its 'most intense day',NBC
FBI failures before the Capitol siege avoided the Jan. 6 committee's scorn. Not for long.,NBC
Democrats ramp up efforts to turn out Puerto Rican voters in Pennsylvania,NBC
Democrats to dub Trump a 'chicken' to pressure him to debate Harris,NBC
The U.S. could see a new 'extreme heat belt' by 2053,NBC
Trump rallies in the South Bronx as he seeks to win over Black and Hispanic voters,NBC
Indian election: Prime Minister Modi's BJP seeks supporters in the U.S.,NBC
"Wisconsin voters face long waits, lines amid coronavirus outbreak",NBC
"How to drive safely with a dog: Shop crash-tested harnesses, crates and more",NBC
South Korean prime minister offers to resign after parliamentary election defeat,NBC
"Harris-Trump debate nabs more than 67 million viewers, Nielsen says",NBC
Pro-Palestinian protests inflame tensions in Washington over the Israel-Hamas war,NBC
Floods in Romania kill at least four people as rain batters central Europe ,NBC
ACLU sues Biden administration over new asylum rule,NBC
"Democrats maintain control of Senate, NBC News projects, defeating many Trump-backed Republicans",NBC
Trump goes after Haley in New Hampshire ad; Biden reschedules Jan. 6 speech: Highlights,NBC
Asian woman punched 125 times in New York attack; suspect charged with attempted murder as hate crime,NBC
Israel vows tough measures to 'strengthen' settlements following deadly attacks,NBC
"Trump slams Harris' call for a price-gouging ban, but 37 states already have their own",NBC
Trump calls people charged and convicted for Jan. 6 riots 'hostages',NBC
"Joe Biden lands 200 judges, highlighting stakes for the courts in the 2024 election",NBC
"The best reusable water bottles of 2026: Stanley, Owala and more",NBC
Four Mark Robinson staffers step down from embattled campaign,NBC
"The best tools for baking cookies, as recommended by professional bakers",NBC
"Echoing DeSantis, Florida's new surgeon general argues against Covid vaccines, mandates",NBC
WWII bomb revealed in drought-hit waters of Italy’s River Po,NBC
At least 90 killed in Israeli military operation targeting two Hamas officials,NBC
Why Sunbasket is one of the best meal delivery services for gluten-free eaters,NBC
Trump says the death of Hamas leader Yahya Sinwar makes a peace deal ‘easier’,NBC
Death of Russian oil exec highlights suspicious ends met by those who crossed the Kremlin,NBC
Hamas leader Ismail Haniyeh says 3 of his sons were killed in an Israeli airstrike in Gaza,NBC
Illinois governor's race shapes up as test of post-Roe abortion politics,NBC
19 last-minute father’s Day gifts on Amazon that are sure to arrive on time,NBC
"Democrats intensify their IVF messaging in new billboards, tying Trump to the Alabama ruling",NBC
Dealing with rosacea and redness? Start with these derm-approved skin care products,NBC
Florida Senate passes GOP bill that would create police force for election crimes,NBC
21 best personalized Father's Day gifts in 2022,NBC
Facebook's Oversight Board to consider if 'from the river to the sea' is hate speech,NBC
Mark Zuckerberg apologizes to parents at online child safety hearing ,NBC
At-home teeth whitening: What products to use and how to make it last,NBC
"Ted Cruz and Colin Allred clash over abortion, trans athletes and Jan. 6 in feisty Texas Senate debate",NBC
11 best weighted blankets and weighted comforters of the year,NBC
JD Vance accused Tim Walz of lying about his IVF experience. Fertility doctors say confusion is common.,NBC
Working remote? These last-minute tech accessories might help,NBC
Donald Trump found guilty in historic New York hush money case,NBC
"Trump interviewed by controversial livestreamer Adin Ross, who gave him a Cybertruck and a Rolex",NBC
Trump's inconsistent messaging clashes with the RNC's attempted embrace of early voting,NBC
"Select Bed & Bath Awards 2023: The best bed sheets, towels, pillows and more",NBC
"There is no trial date in sight for the Trump documents case, as a judge he appointed holds hearing after hearing",NBC
DOJ charges man it says was hired by an Indian government employee with plotting to kill a Sikh activist in NYC,NBC
"We tested over 50 under eye patches – here are our top picks for dark circles, dry skin and more",NBC
Cuisinart’s air fryer is a triple threat — here’s my honest review,NBC
Eight TikTok creators sue U.S. government over potential ban ,NBC
Matthew Shepard’s mom calls anti-LGBTQ bills a ‘vicious attack’ 25 years after his murder,NBC
Indian national extradited to U.S. to stand trial in alleged plot to kill Sikh activist in New York,NBC
The best ankle weights and wrist weights for leveling up your gym or home workout,NBC
Minnesota House Primary Results 2024,NBC
"Former Proud Boys leader Enrique Tarrio gets 22 years, longest Jan. 6 sentence yet",NBC
"The best solar pool covers to heat, insulate and save money",NBC
How to buy a portable charger for every type of device,NBC
U.S. officials expect Israeli response to Iran strikes will be limited,NBC
Team USA beats cricket powerhouse Pakistan in historic World Cup victory,NBC
Record floods hit Dubai after up to 10 inches of rain; 18 dead in Oman,NBC
How Taylor Swift transcends America's political divides — barely,NBC
CIA official: Predictions Afghanistan would become a terrorist launching pad after U.S. exit 'did not come to pass',NBC
Biden campaign set to double down on Black voter outreach with visits to Georgia and Detroit this weekend,NBC
China and Japan end dispute over Fukushima water discharge ,NBC
Abortion rights groups seek ballot measures in 9 more states in 2024,NBC
Allergies acting up? You may need a humidifier. ,NBC
Israel rescues 2 hostages; IDF launches airstrikes on Rafah despite global concern,NBC
Netanyahu signs coalition deal with Israeli far-right,NBC
Israel and Hezbollah strikes put region on edge; Hamas official says delegation has left Cairo,NBC
Sen. Raphael Warnock says embattled N.C. GOP candidate Mark Robinson is ‘white supremacy in blackface’,NBC
"Israeli military says 5 soldiers killed by friendly fire in northern Gaza, more troops to join Rafah operation",NBC
The U.N. begins distributing food aid in Gaza brought ashore by the U.S. military for the first time since June 9,NBC
DNC 2024 highlights: Barack Obama praises Harris and Biden in keynote convention speech,NBC
Jan. 6 rioter who electroshocked Michael Fanone shouts 'Trump won' after he's sentenced to 12½ years,NBC
Hamas is losing the backing of ordinary people in Gaza who are paying the human price of its war,NBC
"Trump Mar-a-Lago search warrant, property receipt show agents found trove of classified docs",NBC
Why Palestinians fear that if they leave northern Gaza they may never be able to return,NBC
Israel-Hezbollah live updates: Netanyahu orders 'full force' in Lebanon despite U.S. cease-fire push,NBC
Jury to begin deliberating in Oath Keepers' Jan. 6 seditious conspiracy trial,NBC
How some of the internet's most popular pro-Trump pundits ended up as paid messengers for Russian propaganda,NBC
"Who is Tanya Chutkan, the judge assigned to Trump’s election case?",NBC
Israeli protests over judicial overhaul continue despite Netanyahu’s pause ,NBC
Tensions simmer in Jerusalem after Israel responds to rocket attacks with strikes on targets in Syria,NBC
The 51+ best October Prime Day Deals that are still live,NBC
Ron DeSantis' political star is tarnished after key Florida primary night losses,NBC
Harris team and White House discussed plans for her to distance herself from Biden,NBC
"Exploding pagers belonging to Hezbollah kill at least 9 and injure more than 2,750 in Lebanon",NBC
"'I'm not a progressive': Fetterman breaks with the left, showing a maverick side",NBC
Republicans take the rare step of censuring Rep. Adam Schiff over Trump-era probes,NBC
Vance says Trump would veto a national abortion ban,NBC
"Hamas attack bears hallmarks of Iranian involvement, former U.S. officials say",NBC
D.C. police officer’s suicide after Jan. 6 riot declared line-of-duty death,NBC
FBI releases declassified document into Saudi 9/11 links after Biden order,NBC
"Janet Jackson tells interviewer she's heard Kamala Harris is not Black, echoing election disinformation",NBC
"A step-by-step guide to getting rid of fleas, according to veterinarians",NBC
Senators unveil bipartisan bill to impose tougher asylum and border laws,NBC
Amazon launches new Kindle Paperwhite e-readers: What you should know,NBC
"Inflation and abortion lead the list of voter concerns, edging out crime, NBC News Exit Poll finds",NBC
Georgia election board votes to require ballots be hand-counted in November,NBC
Hostage deal exposes tensions between Israel’s far-right and hostage families,NBC
How billions in pandemic aid was swindled by con artists and crime syndicates,NBC
Nevada abortion rights groups submit signatures to advance ballot measure,NBC
A death row inmate wrestled with guilt and addiction before his execution,NBC
Death toll rises as Israel battles Hamas,NBC
"The best eco-friendly laundry detergents, according to experts",NBC
"The best ways to store produce and keep it fresh, according to experts",NBC
Administration officials watered down Kamala Harris' Gaza speech before delivery,NBC
Trump allies meet with Prime Minister Netanyahu and other Israeli officials,NBC
Iran holds runoff presidential vote pitting hard-line former negotiator against reformist lawmaker,NBC
Why did Israel blow up Hezbollah pagers and walkie-talkies — and what might happen next?,NBC
Senate Republicans block border security bill as they campaign on border chaos,NBC
"157+ best Cyber Monday deals still live: Amazon, Target, Walmart and more",NBC
Is vitamin E the missing ingredient your skin needs?,NBC
Ga. appeals court grants Trump's request to consider Fani Willis' disqualification from his criminal case,NBC
Trump says crime is out of control. The numbers tell a different story.,NBC
Apple sued by Biden administration over alleged iPhone 'monopoly power',NBC
Making sense of the new polls seven weeks from Election Day,NBC
Our readers’ most purchased tech products in 2023,NBC
"Months after Ahmaud Arbery's death, Georgia governor plans to sign hate crimes bill",NBC
Target has announced its upcoming Target Circle Week — Here’s what we know,NBC
Biden says Supreme Court reforms are needed to counter an 'extreme and unchecked agenda',NBC
"Britain braces for record heat, risking lives and infrastructure",NBC
Bangladesh protesters call on Nobel laureate Muhammad Yunus to lead,NBC
Matt Gaetz's primary is the last stop on Kevin McCarthy's revenge tour,NBC
White House sees Netanyahu as likely to abandon judicial overhaul plan to pursue compromise,NBC
"Foreign national Palestinians can cross from Gaza into Egypt on Monday, officials say",NBC
Election 2024: Harris speaks in Phoenix after Obama's Pittsburgh rally; Biden slams Trump,NBC
"The best moisturizers for mature skin, according to dermatologists",NBC
"Guy Reffitt, first Jan. 6 rioter to go to trial, found guilty on all counts",NBC
Should you be wearing a UPF Sun hat?  Here’s why dermatologists say yes,NBC
Ethics Committee investigating Rep. Matt Gaetz over alleged drug use and sexual misconduct,NBC
Two Alabama fertility clinics say they will resume IVF services after bill to protect doctors passes,NBC
"China is building up its nuclear arsenal faster than predicted, U.S. report says",NBC
"Defying Biden, Netanyahu renews pledge to launch Rafah offensive",NBC
"After years of threats, Trump still doesn't have a plan to replace Obamacare",NBC
44 best gifts for teen girls in 2023,NBC
Prigozhin plane debris points to sabotage,NBC
Election 2024: Trump campaigns in Georgia; Harris weighs trip to southern border,NBC
"Confronted by a Republican voter about the Jan. 6 riot, Trump says 'nothing' was done wrong that day",NBC
"Select Giftable Tech Awards 2023: The best audio, travel, wearable and gaming gear for your gift list",NBC
Germany issues 1st arrest warrant for 2022 Nord Stream pipeline blasts ,NBC
U.S. spy agencies are ready to warn voters about foreign election interference — if it's severe enough,NBC
Italy makes it illegal to seek surrogacy abroad,NBC
"Apple AirTag: Price, features, specs and what you need to know",NBC
"NYC officers scuffle with 14-year-old girl they handcuffed over selling fruit in a park, video shows",NBC
How the Florida judge overseeing Trump's trial could hobble the Justice Department's case,NBC
"Overdose deaths from fake pills are rising, especially among younger adults",NBC
Netanyahu seals dramatic comeback as he is sworn in as Israel prime minister,NBC
Amazon rainforest port records lowest water level in 121 years amid drought ,NBC
Israel and Hamas trade attacks after Biden expresses support for cease-fire,NBC
"25+ Cyber Monday kitchen and home deals from Keurig, KitchenAid, Ninja and more",NBC
Biden dispatches top adviser for talks with Saudi crown prince,NBC
"U.S. soldier detained in Russia and accused of stealing, officials say",NBC
What the U.S. recognizing a Palestinian state would mean,NBC
Army says a Trump aide 'abruptly pushed aside' an Arlington National Cemetery employee,NBC
Lawmakers grill Defense Secretary Lloyd Austin over secret hospitalization,NBC
Palestinian gunman kills 2 as officials meet to discuss surge in violence,NBC
"Florida Supreme Court allows 6-week abortion ban to take effect, but voters will have the final say",NBC
Trump repeats false claims that children are undergoing transgender surgery during the school day,NBC
Republicans up the personal attacks on Biden and his family,NBC
Trump's second impeachment trial is underway and the verdict is already in,NBC
Fake news YouTube creators target Black celebrities with AI-generated misinformation,NBC
Trump says there will be a 'bloodbath' if he loses the election,NBC
The Amazon Echo Show 15 available for preorder: What to know,NBC
Trump pushes false claims about mail-in vote fraud. Here are the facts.,NBC
How often should you wash your hair? Experts weigh in,NBC
Puerto Rico hit by a 5.0 quake amid ongoing seismic activity,NBC
Jimmy Carter turns 100,NBC
Best smart home devices for 2020,NBC
"Harris leads Trump by almost 40 points among Asian American voters, a new poll shows",NBC
GOP crackdowns on noncitizen voting ensnare newly naturalized Americans,NBC
Russian veto brings an end to the U.N. panel that monitors North Korea nuclear sanctions,NBC
North Korea says it is suspending military pact with South,NBC
DOJ seeks longer sentence for Capitol rioter they labeled as a domestic terrorist,NBC
"Biden blasts Alabama Supreme Court's IVF ruling as Harris, campaign blame Trump",NBC
"15 best grilling accessories, according to food experts",NBC
Trump splits with ally McCarthy over Ashli Babbitt shooting on Jan. 6,NBC
Harris maintains strong lead among Black swing-state voters in a new poll,NBC
Banned political ads found on TikTok weeks ahead of 2024 elections,NBC
I tried Yeti’s French press for over a month — here’s why I loved every minute of it,NBC
The Hatch Restore 2 is the secret to my early mornings,NBC
"'Sad, worried, inconsolable': Earthquakes trigger anxiety in Puerto Rico, post-Hurricane Maria ",NBC
22 bestselling pet products on Amazon for your furry friend,NBC
Hamas issues defiant message after Sinwar's death; Israel says war will continue,NBC
Trump fan gets eight years for assaulting officers during Jan. 6 Capitol breach,NBC
Inside the poll numbers: Which key groups have moved — and which ones haven't — since Biden's exit,NBC
Fentanyl plus stimulants drives ‘fourth wave’ of overdose epidemic in the U.S.,NBC
Jailed Iranian activist Narges Mohammadi wins Nobel Peace Prize for fight against oppression of women,NBC
"Russia operated nearly 1,000 sock puppet accounts on X, Justice Department says",NBC
October heat wave sets dozens of records in California and Arizona,NBC
"9/11 group blasts Trump for hosting Saudi-backed golf league tournament, seeks meeting",NBC
South Korea to suspend military pact with North over trash balloons,NBC
Ex-Trump press secretary Stephanie Grisham says he mocked his supporters as 'basement dwellers',NBC
Trump's Mideast peace plan comes under surprise attack from Israeli settlers ,NBC
A wave of deadly walkie-talkie explosions sweeps Lebanon day after widespread pager attack,NBC
"Heat waves hitting U.S. and Europe 'virtually impossible' without climate change, researchers say",NBC
Roomba robot vacuums: Everything you need to know before you buy,NBC
White House says Biden and Harris weren’t invited to Arlington Cemetery by families of service members killed during Afghanistan withdrawal,NBC
"Top-rated organic, natural and eco-friendly mattresses",NBC
U.N. Security Council fails to pass U.S. resolution calling for Gaza cease-fire,NBC
"Israel faces a genocide case, and comments on displacing Gazans could complicate its defense",NBC
U.S. and Israel increasingly isolated amid growing cease-fire calls,NBC
"Anti-U.S. opinion in Arab countries grows over support for Israel, leaders tell Blinken",NBC
