headline,source
New poll reveals voters' thoughts on Kamala Harris if Biden can't finish second term,FoxNews
,FoxNews
Migrant crisis roils Boston area as school stands firm on contentious residency policy,FoxNews
,FoxNews
Kamala Harris has avoided interviews for more than two weeks since becoming Dem nominee,FoxNews
"In protests against Israel, 'American way of freedom' is being 'deeply challenged,' says author and historian",FoxNews
NYC's hidden history: Jimi Hendrix recorded his last track at this Manhattan recording studio he built himself,FoxNews
"Stories of torture, torment revealed by Israeli children kidnapped by Hamas terrorists",FoxNews
Fox News Poll: Harris tops Trump by two points,FoxNews
"Trump, Harris blasted for ignoring exploding budget deficit, as economists plead with both to 'get real'",FoxNews
Biden admin outlaws Palestinian organization for funding terrorism: 'Sham charity',FoxNews
Flashback: Kamala Harris was open to packing Supreme Court to shift balance away from conservatives,FoxNews
,FoxNews
Iranian President Raisi is killed in helicopter crash,NBC
Kristen Cavallari and Jay Cutler to divorce after 10 years together,NBC
Why Atlanta spa shooter's Asian 'acquaintances' can't tell us much about his racial biases,NBC
The best TV streaming services in 2026,NBC
Mike Johnson won't commit to bringing House back before the election for more hurricane relief,NBC
Palestinians are using donated eSIM cards to stay in touch with the outside world ,NBC
"New FBI stats show 'historic' declines in violent crime rate, with murder showing sharpest drop",NBC
"Who was Hassan Nasrallah, the Hezbollah leader killed in Beirut strike",NBC
U.S. and China take cautious steps to repair ties,NBC
15+ best car accessories on Amazon to shop right now,NBC
"Key Nebraska Republican opposes changing how the state awards electoral votes, blocking Trump push",NBC
Trump courts rappers as surrogates for his campaign to win more voters of color,NBC
"Trump has some immunity in D.C. election interference case, Supreme Court rules: Highlights",NBC
How an Elon Musk-backed PAC is gathering data to boost Trump,NBC
Is prebiotic soda actually better for you? Doctors and nutritionists weigh in,NBC
"Jan. 6 rioter asks for early release, says he was ‘manipulated’ by Trump and Fox News",NBC
Secretary of State Antony Blinken declines to identify 'red line' for aid to Israel,NBC
Trump falsely accuses Harris of deciding to 'turn Black' during a combative panel with Black journalists,NBC
Poll: Half of voters plan to cast their ballots early — with a stark partisan divide,NBC
"Stampede at religious event in India kills more than 100 people, almost all of them women",NBC
101+ Latino-owned brands to know and support in 2026,NBC
S.C. man sentenced to life in prison for murdering Black trans woman after historic verdict,NBC
Microsoft CEO Satya Nadella calls for coordination to address AI risk,NBC
Prosecutor tells jurors 'ecstatic' Jan. 6 defendant bragged about carrying gun,NBC
"Trump is not immune in 2020 election interference case, appeals court rules",NBC
DNC 2024 highlights: Biden passes torch to Harris in Democratic convention speech,NBC
Top Democrat urges Biden admin to do more to help local election officials fight a flood of disinformation,NBC
GOP turns the spotlight on Sen. Bob Casey's family ties in key Pennsylvania race,NBC
Trump's GOP critics take aim after indictment is unsealed,NBC
Ex-police chief who spread conspiracies about Jan. 6 found guilty in Capitol attack,NBC
Treasury Department now using AI to save taxpayers billions,NBC
How Ron DeSantis’ super PAC is taking financial pressure off his campaign,NBC
Trump accuses DOJ of 'mishandling and downplaying' second assassination plot,NBC
"After false pet claims, Springfield mayor says Trump visit would be 'an extreme strain' on resources",NBC
Pro-China influence campaign pushed talking points across more than 50 websites,NBC
Trump says he would pardon a 'large portion' of Jan. 6 rioters,NBC
Jan. 6 committee avoids criticizing law enforcement in report summary,NBC
Best portable air conditioners under $400 to help you beat the heat,NBC
The JBL Clip 5 is my go-to portable speaker and I take it almost everywhere I go,NBC
"The best disposable face masks and how to shop for them, according to doctors",NBC
Historic North Carolina village underwater after devastating damage from Helene,NBC
Senior Hamas leader killed in Beirut was a key figure who patched up ties with Iran,NBC
Abortion rights amendments qualify for the ballot in Colorado and South Dakota,NBC
'Totally illegal': Trump escalates rhetoric on outlawing political dissent and criticism,NBC
QAnon follower who led the mob that chased Police Officer Eugene Goodman on Jan. 6 sentenced to 5 years in prison,NBC
DeSantis signs bill creating election police unit in Florida,NBC
"Russia aims to undermine Biden in November election, intel officials say",NBC
Nebraska Supreme Court rules convicted felons who completed their sentences can vote,NBC
Jan. 6 hearing highlights: Cassidy Hutchinson gives explosive testimony about the Trump White House,NBC
Judge hits pause on Trump federal election case over presidential immunity appeal,NBC
Israeli parliament passes key part of Netanyahu's divisive judicial overhaul plan ,NBC
Trump Media plummets 10% as post-lockup selloff picks up steam  ,NBC
NBC News investigation reveals Israel strikes on Gaza areas it said were safe,NBC
"Racism, sexism must be considered in Atlanta case involving killing of six Asian women, experts say",NBC
Harris campaign office damaged by gunfire in Arizona,NBC
'They're not here to hurt me': Former aide says Trump knew Jan. 6 crowd was armed,NBC
Two immigration moves underscore the issue’s 2024 potency: From the Politics Desk,NBC
Putin and Xi vow to deepen 'no limits' partnership as Russia advances in Ukraine,NBC
Israel and Gaza conflict in photos,NBC
Can you use micellar water as dry shampoo? Experts weigh in,NBC
"The 14 best raised garden beds for growing plants, veggies and more outdoors",NBC
Harris branches out while Trump preaches to the choir in divergent media strategies,NBC
Sen. Mike Lee promotes a debunked conspiracy theory about a Jan. 6 rioter,NBC
Jan. 6 panel warns of attempts to 'influence' witnesses by Trump allies,NBC
Dealing with dandruff? These 11+ shampoos can help,NBC
"Republicans win control of the House, NBC News projects, overtaking Democrats by a slim margin",NBC
Abortion rights have won in every election since Roe v. Wade was overturned,NBC
'All Eyes on Rafah' image shared by millions on Instagram following Israeli airstrike,NBC
"Israel-Hamas war: Dozens killed in attack on crowd waiting for aid, Gaza health officials say",NBC
Deal brokered to get medicine to hostages and more aid for Gaza  ,NBC
The 8 best indoor garden systems for growing fresh herbs on your counter,NBC
Some ex-DOJ officials who worked for Trump fear the Supreme Court just made it easy for him to use the DOJ to attack foes,NBC
White House condemns university presidents after contentious congressional hearing on antisemitism,NBC
"The 9 best stainless steel cookware, according to culinary experts",NBC
Google says it will remove Canadian news links from searches in the country,NBC
"Trump received at least $7.8 million in payments from foreign governments as president, House Democrats say",NBC
U.S. to send troops to be ready to help evacuate U.S. citizens from Lebanon,NBC
Biden orders declassification of Sept. 11 investigation documents ,NBC
"Overdose death rate increased by 30% in 2020, a 'staggering' rise",NBC
Harris-Walz win would make Minnesota's Peggy Flanagan its first Native American and female governor,NBC
China halts foreign adoptions of its children,NBC
"Biden signs TikTok ban for government devices, setting up a chaotic 2023 for the app",NBC
Netanyahu calls Israeli strike that killed dozens in Gaza tent camp 'tragic',NBC
Cuba's president blasts 'interventionist' U.S. amid protests over shortages,NBC
"Israel sets new war goal, adding to signs of escalation with Hezbollah",NBC
Supreme Court appears likely to uphold Biden plan to crack down on 'ghost gun' kits,NBC
Four officers who responded to Capitol riot have died by suicide,NBC
"As death toll mounts in Gaza, veterans of past negotiations weigh in on possibilities for peace",NBC
Bolton's book suggests Trump corruption runs deep. Worse? Republicans don't care.,NBC
Democrats continue to joke about false JD Vance rumor after years of criticizing Trump for spreading misinformation,NBC
Trump begs Georgia secretary of state to overturn election results in remarkable hourlong phone call,NBC
Tourists who came for a sunny Disney vacation are instead stranded by the storm,NBC
Biden sets a 10-year deadline for U.S. cities to replace lead pipes and make drinking water safer,NBC
Jan. 6 rioter who smashed Capitol window with tomahawk ax sentenced to 7 years,NBC
"Six months after ‘zero Covid,’ U.S. firms in China still face ‘uncertainty on top of uncertainty’",NBC
"11 best pruning shears, according to gardeners",NBC
Mark Robinson vows to stay in N.C. governor's race following report he made inflammatory comments on a porn site,NBC
"Ron DeSantis, using the levers of state government, ramps up efforts to defeat Florida abortion-rights ballot measure",NBC
From 'rapists' to 'eating the pets': Trump has long used degrading language toward immigrants,NBC
"As an election denier became speaker, a Capitol officer testified that Jan. 6 tore her life apart",NBC
Heat in one Arizona county played a role in 645 deaths last year ,NBC
Hackers rally behind Kamala Harris' presidential campaign,NBC
What’s fueling the rise in Hindu nationalism in the U.S.,NBC
Army investigating whether detained U.S. soldier was lured to Russia by intelligence services,NBC
"Canada expels top India diplomats, links them to murder of Sikh leader",NBC
Biden to give first major foreign policy address on 'restoring America's place in the world',NBC
Iran's Supreme Leader calls for 'maximum turnout' amid voter apathy,NBC
23 Father's Day gift ideas for new and soon-to-be dads,NBC
Abortion rights advocates see a flurry of post-Roe victories in midterms,NBC
New Covid fraud prosecutor steps up effort to convict people who stole billions in relief benefits,NBC
DeSantis debate memo urges him to defend Trump and take 'a sledge-hammer' to Ramaswamy,NBC
The 56 best Valentine’s Day gifts for everyone in your life,NBC
DOJ closes Pence classified documents investigation with no charges,NBC
"Israel should 'erase' Palestinian village, minister says after settler rampage",NBC
'Where do we go?': Palestinians flee Rafah after Israel orders evacuation before expected ground assault,NBC
Hamas fires rockets into Israel as tensions in Jerusalem boil over,NBC
University leaders condemn Jewish genocide rhetoric as backlash grows,NBC
Biden administration lifts Trump-era restrictions stalling Puerto Rico hurricane aid,NBC
Biden speaks with Netanyahu as White House prepares for Herzog meeting,NBC
DNC 2024 highlights: Biden passes torch to Harris in Democratic convention speech,NBC
Taylor Swift endorses Joe Biden for President,NBC
Hezbollah launches barrage of rockets at Israel after senior commander killed,NBC
President Biden publicly acknowledges 7th grandchild for first time,NBC
GOP donors pour hundreds of millions into pro-Trump super PACs before Election Day,NBC
Trump and Harris battle over male voters — and what masculinity looks like in 2024,NBC
Doug Emhoff acknowledges reports of an affair during his first marriage,NBC
A Black conservative radio host invoked 'field' and 'house' slaves in arguing why some Black men back Trump,NBC
Israel has a long track record of assassinating its enemies. Will it work against Hamas?,NBC
DNC 2024 highlights: Barack Obama praises Harris and Biden in keynote convention speech,NBC
Nathan Wade resigns from Fani Willis-led Trump election case after judge's ruling: Highlights,NBC
Amazon's Climate Pledge Friendly products: A shopping guide,NBC
"At Supreme Court, Trump lawyer backs away from absolute immunity argument",NBC
MLB playoff viewership surges as big-market stars vie for World Series  ,NBC
"Trump authorized Soleimani's killing 7 months ago, with conditions",NBC
'American Sports Story' re-examines the rise and fall of NFL star Aaron Hernandez,NBC
Service members and veterans are fighting for the right to fertility treatments,NBC
Iran may be preparing to arm Russia with short-range ballistic missiles,NBC
Blinken arrives in Israel to strengthen Gaza cease-fire,NBC
The left faces a reckoning as Israel divides Democrats ,NBC
Virginia Democrats block GOP bid to take full control of state government,NBC
Palestinians announce first elections in 15 years on eve of Biden era,NBC
China’s exit bans multiply as political control tightens under Xi,NBC
X blocked in Brazil after supreme court panel upholds suspension order,NBC
20 best Father's Day fishing gifts for dad,NBC
"Law protecting Alabama IVF may do more harm than good, critics say",NBC
Election 2024: Trump courts Jewish voters; Harris participates in event hosted by Oprah Winfrey ,NBC
"70+ best Cyber Monday beauty, skin care and other wellness deals",NBC
Florida abortion rights groups collect enough signatures to advance 2024 ballot measure,NBC
Sarah McBride launches historic bid to become first trans member of Congress,NBC
Religious violence reaches India’s capital as a Hindu mob swarms a church,NBC
31 best Amazon products to organize every room in your home,NBC
Alabama governor signs bill to protect IVF treatments into law,NBC
Middle-class homeowners are increasingly squeezed by housing costs,NBC
Trump refuses to acknowledge his 2020 loss and dodges debate question about his Jan. 6 actions,NBC
"The best electric toothbrushes for kids, according to the ADA and dentists",NBC
"Fire raging, blood everywhere: What we know about Israeli strike on a tent camp in Rafah",NBC
Palestinian President Mahmoud Abbas cuts security ties with Israel over West Bank annexation plans,NBC
"Facing criticism for being too walled off, Harris slowly opens the door to more media interviews ",NBC
Judge says Mike Lindell must pay $5 million to man who won his 'Prove Mike Wrong' challenge,NBC
India blocks independent news outlet in Kashmir,NBC
Israel orders new evacuations in Rafah as it prepares to expand operations in Gaza's southernmost city,NBC
Brazil’s top court orders nationwide suspension of Elon Musk’s X,NBC
U.S. support for Israel's campaign in Lebanon is 'limited' to Hezbollah,NBC
"North Korean special forces in Russia readying for combat in Ukraine war, South Korea says",NBC
Ruben Gallego and Kari Lake square off in sharp-edged Arizona Senate debate,NBC
"Milton shreds roof of Tropicana Field, home of baseball's Tampa Bay Rays",NBC
Ron DeSantis quietly signs Florida's 6-week abortion ban into law,NBC
Police arrest man after Korean American candidate's campaign signs appear spray-painted with slurs,NBC
Biden calls on nations to unite amid an 'inflection point in world history' in last U.N. speech,NBC
"Scott Presler, a conservative activist who has spread conspiracy theories, won't be getting an RNC job",NBC
Meet some of the violent Jan. 6 rioters Donald Trump keeps calling 'hostages',NBC
"Local police responsible for roof where Trump shooter hid at Butler rally had never spoken to Secret Service, report says",NBC
Intel community escapes major criticism by Jan. 6 committee for missing 'foreseeable' Capitol violence,NBC
Liam Payne’s cause of death confirmed in autopsy report: What is polytrauma?,NBC
Share of college students blaming Hamas for Oct. 7 attack on Israel declines in new poll,NBC
"Conservative influencer helped steal a table used to assault officers on Jan. 6, FBI says",NBC
Teen recounts horror after his mom and brother were burned alive by Israeli strike on Gaza hospital,NBC
Hurricane Otis: How a tropical storm turned into a 'nightmare scenario' overnight,NBC
7 highly rated ice cream makers for homemade frozen treats ,NBC
"‘Every day we get closer’ to normalization with Israel, Saudi crown prince says in rare interview ",NBC
States are rapidly adopting laws regulating political deepfakes,NBC
"Palestinian gunman wounds 2 in Jerusalem, a day after 7 were killed",NBC
'Derrick Evans is in the Capitol!' he yelled. Derrick Evans has now been sentenced for storming the Capitol.,NBC
"Coup attempt thwarted in Ukraine, Security Service says, as Hungary's Orbán arrives in Kyiv for talks",NBC
"Suspect in death of 6-year-old Palestinian American boy was obsessed with Israel-Hamas war, prosecutors say",NBC
Amazon’s bestselling women’s walking shoes for every foot type,NBC
"The best ergonomic office chairs to increase productivity, according to experts",NBC
Misinformation about Israel and Hamas is spreading on social media,NBC
The Covid summer wave is here,NBC
"What to know about Bluesky, the Twitter alternative that some celebrities and journalists are joining",NBC
"We’ve worn these hiking shoes for hundreds of miles, in sun and snow",NBC
Judge denies special counsel's request to impose gag order on Trump over false claim about FBI raid,NBC
"The U.S. crime rate is still dropping, FBI data shows",NBC
"Netanyahu has weathered many political storms, but the Oct. 7 attack is the strongest one yet",NBC
Trump courts Black men as he pledges return to a policy that disproportionately targeted them,NBC
Gaza's 2.2 million people are confined to a humanitarian area smaller than Manhattan,NBC
Puerto Rico sees more pain and little progress three years after Hurricane Maria,NBC
Secret Service chief makes remarkable admission: We need a ‘paradigm shift’,NBC
"North Korean soldiers are training to fight for Russia, Ukraine says",NBC
"Sinwar, mastermind of Oct. 7 attacks, was long sought by Israeli forces",NBC
"The best women's sneakers for wide feet, according to podiatrists",NBC
Election 2024: Harris goes on high-profile media blitz; Trump postpones town hall with RFK Jr.,NBC
"Trump rages at Bolton, says former adviser would have caused 'World War Six'",NBC
Editor’s picks: 27 products we’re obsessed with from March,NBC
"Sextortion training materials found on TikTok, Instagram, Snapchat and YouTube, according to new report",NBC
Wife of Jan. 6 officer who died after riot feels duty to represent him at hearings,NBC
Biden says it's 'outrageous' ICC is seeking arrest warrants for Netanyahu and Israeli leaders,NBC
"Senate Republicans knife bipartisan border security bill, declaring it dead",NBC
"Russia, Ukraine exchange 206 prisoners in second swap in two days ",NBC
Videos and flight radar show plane crash believed to have killed Prigozhin,NBC
House leaves town until September with little to show voters,NBC
Grace & Stella’s highly rated eye masks are 57% off for Prime Day,NBC
Don’t peel that sunburn — try these dermatologist-approved treatments instead,NBC
North Korea launches ICBM after threatening U.S. over alleged spy flights,NBC
Floods claim two more casualties as torrential rain batters central Europe ,NBC
Full Transcript: Read Lester Holt’s interview with Iranian President Ebrahim Raisi,NBC
Stormy Daniels must pay $300k to Donald Trump after losing defamation case appeal,NBC
12 best Father's Day grilling gifts,NBC
Speaker Mike Johnson and Trump allies who tried to overturn the 2020 election roll out voting 'integrity' bill,NBC
Nevada governor signs new abortion protections into law,NBC
Hostage rescue complicates U.S. push for a cease-fire deal,NBC
Is a Target Circle membership worth it? Here's what to know,NBC
Israel's Knesset votes overwhelmingly against Palestinian statehood as Netanyahu prepares for U.S. visit,NBC
Trump says he wants to make IVF treatments paid for by government or insurance companies if elected,NBC
Man sentenced to over 6 years in the Jan. 6 assault on Capitol Police Officer Brian Sicknick,NBC
Kremlin claims Trump sent Covid test machines to Putin,NBC
"How to clean a coffee maker, according to cleaning experts",NBC
Israel considers flooding Hamas tunnels as it pursues top leader thought to be hiding underground,NBC
Bestselling tech: The most purchased tech products we covered in 2022,NBC
Fact-checking the presidential debate between Trump and Harris,NBC
Top-rated pet cameras: How to find the best one for your home,NBC
"The U.S. and Iran are holding indirect talks on a possible prisoner exchange, with the help of the U.K. and Qatar, sources say",NBC
Trump fan featured in Biden ad admits assaulting officers with bear spray on Jan. 6,NBC
Trump appears on YouTuber Logan Paul’s podcast in a bid for young voters,NBC
Rocket attack on town in Israeli-controlled Golan Heights kills 11; Netanyahu hurries home,NBC
Stern U.S. letter prompts Israel to allow first aid into northern Gaza this month. Will it last?,NBC
"12 pet hair removers that really work, according to experts",NBC
Sheets and pillowcases worth considering this year,NBC
Here's what top Trump VP picks say about the 2020 election results — and whether they'll accept the 2024 outcome,NBC
Arizona Gov. Katie Hobbs signs repeal of 1864 abortion ban,NBC
"As Gaza death toll tops 30,000, is Israel on the path to victory or quagmire?",NBC
How a N.Y. ballot measure became a battleground in the culture wars,NBC
Far-right groups blocking Gaza aid receive tax-deductible gifts from U.S. and Israel,NBC
"Faced with the unique challenges of filling a potential Trump Cabinet, quiet transition work is underway",NBC
"4.8M borrowers — including 1M in public service — have had student debt forgiven, Biden admin says",NBC
Trump's Black GOP allies challenged during tense discussion tailored to Black men,NBC
Judge Aileen Cannon denies another Trump motion to dismiss classified documents case,NBC
"Before anniversary of mass protests, Iran’s leader expresses no regrets",NBC
Can Israel take out the tunnels that Hamas uses to move its fighters and weapons? ,NBC
Capitol security officials blame poor intelligence — and one another — for the Jan. 6 riot,NBC
Top Meadows aide Cassidy Hutchinson to testify at Jan. 6 hearing,NBC
U.S. still sending some weapons to Israel despite holding up bomb shipment over Rafah assault plans,NBC
From a D.C. studio to an indictment: How a Russia-funded media outlet seeded propaganda in the U.S.,NBC
"Israel-Hamas cease-fire close to the goal line, Blinken says ",NBC
Jan. 6 participant arrested after hourslong standoff with the FBI,NBC
'Obviously a mistake': Sen. Ted Cruz says he regrets going to Cancún while Texans froze,NBC
A Florida man riding out Hurricane Milton on his boat alarms TikTok and local officials,NBC
"GOP Sen. Murkowski says she will vote against witnesses, calls impeachment articles 'rushed and flawed'",NBC
'Easy money': How international scam artists pulled off an epic theft of Covid benefits,NBC
Clippers star Kawhi Leonard reportedly out indefinitely with knee inflammation,NBC
"The right order to apply your skin care products, according to dermatologists",NBC
House committee skewers Secret Service director for not answering major questions on Trump assassination attempt,NBC
"How to build a multistep Korean skin care routine, according to experts",NBC
"Nikki Haley ends presidential campaign with 'no regrets,' ceding GOP nomination to Trump",NBC
"Israel airstrikes hit Gaza after rocket attacks, clashes intensify in Jerusalem",NBC
Netanyahu opponent and war Cabinet member's party tries to force early Israel election,NBC
Mike Johnson announces vote on bill to avoid government shutdown,NBC
"Palestinians fatally shoot 4 Israelis, spurring West Bank revenge attacks ",NBC
We've tested dozens of vitamin C serums — here are the best ones,NBC
Federal appeals court upholds but narrows the gag order in Trump's D.C. election interference case,NBC
Health care fraudster Philip Esformes is latest Trump clemency recipient to be arrested ,NBC
Harris campaign launches WhatsApp channel aimed at bilingual Latino voters,NBC
"7+ best under bed storage options for small apartments, dorms and more ",NBC
"What to buy (and skip) this 4th of July, according to experts ",NBC
Sen. Lindsey Graham's phone being investigated for potential hack,NBC
Trump supporter charged with firing a gun during the Jan. 6 Capitol attack,NBC
Atlanta-area spa shooter convicted in 4 deaths pleads not guilty to 4 more killings on the same day,NBC
Chuck Todd: Why we're in Milwaukee,NBC
"The best multiplayer Nintendo Switch games, according to experts",NBC
"Israel violence, from Al-Aqsa protests to Palestinian rockets, helps Netanyahu and Hamas",NBC
Biden cancels nearly $6 billion in student debt for 78K public service workers,NBC
31+ problem-solving Amazon kitchen gadgets that home chefs will find useful,NBC
Trump vows to 'free' Jan. 6 defendants as one of his first acts if elected,NBC
U.S. officially points the finger at Saudi Crown Prince Mohammed bin Salman for Khashoggi killing,NBC
Instagram will use 'nudges' to start suggesting teens log off at night,NBC
"Displaced by the earthquake, Puerto Ricans cope with constant aftershocks and uncertainty",NBC
"Trump announces aid for Puerto Rico, infusing politics in an apparent play for Florida voters ",NBC
Biden says he's 'not surprised' by judge's 'specious' decision to toss Trump documents case,NBC
12 best grocery delivery services for food and everyday essentials,NBC
Trump attends 9/11 event with a far-right activist who pushed a conspiracy theory about the tragedy,NBC
Israel-Iran: Netanyahu and Biden talk for the first time since August; Israel warns Lebanon of destruction like Gaza's,NBC
"As bombs fall silent over Gaza and Israel, 'whole generation' of children face long term trauma",NBC
Trump signals support for a national 15-week abortion ban,NBC
"Poll: Newly popular Harris builds momentum, challenging Trump for the mantle of change",NBC
"The 6 best mattresses for side sleepers, according to experts",NBC
Elon Musk has given nearly $75 million to his pro-Trump super PAC,NBC
