headline,source
Jack Carr recalls Gen. Eisenhower's D-Day memo about 'great and noble undertaking',FoxNews
"Bruce Willis, Demi Moore avoided doing one thing while co-parenting, daughter says",FoxNews
,FoxNews
"Emily Blunt says her ‘toes curl’ when people tell her their kids want to act: 'I want to say, don’t do it!'",FoxNews
"'The View' co-host, CNN commentator Ana Navarro to host night 2 of Democratic National Convention",FoxNews
,FoxNews
,FoxNews
"Tom Cotton turns tables on CNN's Dana Bash on guns, brings up Harris' past remarks on school shootings",FoxNews
"Kamala rides tsunami of positive press, but skeptics see a risky choice",FoxNews
Harris' running mate faces renewed scrutiny after his 'weird' socialism comparison resurfaces,FoxNews
"Israeli-American reservist killed by Hezbollah missile in Israel, IDF says",FoxNews
"David McCullough, American historian and Presidential Medal of Freedom recipient, dies at 89",FoxNews
Web designer who refuses to create sites for same-sex weddings says Colorado law violates free speech rights,FoxNews
Simon Cowell reveals how his son changed his judging style: ‘I have much more empathy’,FoxNews
Rare Disease Day: Walking Dead Syndrome and other rare conditions baffle doctors and researchers,FoxNews
CNN calls out Harris for using Trump's border wall in campaign ad after condemning it for years,FoxNews
"Taylor Swift steals NYC spotlight during dinner with Blake Lively, Sophie Turner and Brittany Mahomes",FoxNews
"Ozempic, the happy drug? Study suggests weight-loss medications could reduce depression, anxiety",FoxNews
,FoxNews
,FoxNews
"Israel declares war after Hamas surprise attack, launches retaliatory airstrikes in Gaza",FoxNews
"Taylor Swift, Travis Kelce get support from family after surprise 'Eras Tour' stage appearance",FoxNews
"The Doors' Jim Morrison had ‘a fascination with death’ before passing away at 27, bandmate Robby Krieger says",FoxNews
Walz repeats Georgia abortion death falsehood decried by doctors as 'fearmongering',FoxNews
"Harris campaign won't give details on type of gun she owns, last time she went to range",FoxNews
"Utah mom kept missing daughter, 5, hidden in cult 'compound' for months with help from adult sons: prosecutors",FoxNews
"Kamala Harris' far-left record dismissed as 'accusations,' attacks from Trump and GOP: 'She's moderate'",FoxNews
Israel Defense Forces confirm 'targeted strike' on Beirut,FoxNews
"Pope Emeritus Benedict XVI dead at 95, Vatican says",FoxNews
Sheldon Whitehouse doesn't denounce super-exclusive beach club his family belongs to,FoxNews
,FoxNews
'Star Wars' actress Carrie Fisher honored with star on Hollywood Walk of Fame amid family drama,FoxNews
"AOC fires back at Fetterman, accuses him of 'bleak dunk attempt'",FoxNews
,FoxNews
,FoxNews
,FoxNews
JD Vance calls out 'deranged' mindset that we need illegal immigrants to build houses,FoxNews
"Meet the American who created bubble gum, Walter Diemer, home-kitchen chemist outwitted scientists",FoxNews
Biden campaign sends all-staff memo hoping to calm post-debate concerns,FoxNews
,FoxNews
"Harris supporters say she'll fix immigration, blame Trump for border crisis",FoxNews
,FoxNews
Harrison Ford mocks Conan O’Brien after 'Star Wars' dis: ‘You can't f---ing remember',FoxNews
Franklin Graham's Samaritan's Purse sponsors 21 ambulances in Israel to replace those destroyed by Hamas,FoxNews
,FoxNews
How Secret Service protocol has changed amid presidential assassination attempts through the years,FoxNews
,FoxNews
Fox Nation to debut new American history series hosted by Kelsey Grammer,FoxNews
Trump calls Liz Cheney a 'low IQ war hawk' after appearance in support of Harris,FoxNews
,FoxNews
"How Stairwell B became the site of a miracle amidst the tragedy of Sept. 11, 2001",FoxNews
"The best vegetables for your health, according to nutritionists",FoxNews
Eagles' Nick Sirianni has heated spat with fans after close win vs Browns,FoxNews
America's 'unique' Thanksgiving stuffing preferences state-by-state,FoxNews
,FoxNews
,FoxNews
,FoxNews
"Black Lives Matter blames US, praises Cuban regime, social media erupts",FoxNews
"How US government will dole out aid to victims of Hurricanes Milton, Helene",FoxNews
Biden admin is rushing to industrialize US oceans to stop climate change: 'Environmental wrecking ball',FoxNews
"Honduran illegal immigrant deported from US twice, sentenced for leading Texas burglary ring: 'Masterminded'",FoxNews
,FoxNews
,FoxNews
Anti-Israel Yale protesters joining Columbia students in 'tear down our society' Ivy League movement: Law prof,FoxNews
Idaho gov praises Boise State’s decision to forfeit women’s volleyball match against team with trans player,FoxNews
Billy Joel unveils 50-pound weight loss at Madison Square Garden following back surgery,FoxNews
"Tequila is more than just a shot, plus other fun facts about this spirit",FoxNews
,FoxNews
Christian parents complain after 11-year-old daughter forced to share bed with biological male on school trip,FoxNews
"'Slap in the face': Media, government downplaying Venezuelan gangs, says woman who fled her Colorado apartment",FoxNews
,FoxNews
,FoxNews
Inside San Jose State's police battle to protect women's athletes threatened by a transgender culture war,FoxNews
Fox News Power Rankings: Trump maintains lead on 2 top issues ahead of VP debate,FoxNews
"Kate Moss, 50, takes Victoria's Secret fashion show by storm in surprise appearance with daughter Lila, 22",FoxNews
"Five more House Democrats call on Biden to drop out, third US senator",FoxNews
,FoxNews
Hilary Duff lands ‘How I Met Your Father’ series sequel role for Hulu,FoxNews
"FLASHBACK: New Harris campaign senior adviser made several insensitive comments about women, gay people",FoxNews
Michigan becomes a top GOP Senate target as Mike Rogers ties with Dem opponent among older voters,FoxNews
American women players settle suit vs. US Soccer for $24M,FoxNews
Herschel Walker says Obama 'forgot our fight for right to vote' after scolding Black voters against Harris,FoxNews
,FoxNews
NJ announces emergency dune repairs in shore town penalized for doing them itself,FoxNews
CNN political director warns of 'trouble sign for Harris' as she lags with White male voters in key states,FoxNews
"Japanese soufflé pancake gaining popularity in US, yet origin story begins in Hawaii 15 years ago",FoxNews
"Garlic: Planting, roasting and understanding the health benefits of the plant",FoxNews
"Olympic boxer deemed to have male chromosomes wins fight in 46 seconds, opponent left in tears after hard hits",FoxNews
Women's volleyball team with transgender player getting police protection amid backlash and lawsuit,FoxNews
Oprah Winfrey makes surprise DNC appearance to rail against man she once considered running for office with,FoxNews
,FoxNews
German bureaucrat under fire for trashing British WWII hero who inspired Israeli army,FoxNews
Sniper killed would-be Trump assassin with 'one-in-a-million shot': source,FoxNews
RFK Jr says ‘corporate media’ has attacked him ‘even more than President Trump’,FoxNews
Harris-Trump showdown: Group of former law enforcement leaders takes sides in presidential election,FoxNews
"Brian Stelter defends media not covering Hunter Biden in 2020, says critics don't know 'how newsrooms work'",FoxNews
TikTok video at fast-food restaurant shows how speedy machine makes salad bowl in no time,FoxNews
"On this day in history, February 17, 1801, Jefferson is elected president as party politics divide new nation",FoxNews
,FoxNews
Biden called out on border crisis by Texas Democrat: 'Absolutely the president should be here',FoxNews
"Biden admin unveils sweeping new actions increasing costs for oil, gas leasing",FoxNews
,FoxNews
"Texas woman accidentally swallows partial dentures, here's how a medical team saved the day",FoxNews
'America's Got Talent' judge Heidi Klum 'did not expect' 9-year-old's epic Tina Turner performance,FoxNews
New study reveals extreme weather's impact on seniors' attendance at doctor appointments,FoxNews
"On this day in history, February 12, 1809, Abraham Lincoln is born in Kentucky",FoxNews
,FoxNews
7 sneaky calorie culprits that are creeping into your healthy green salad,FoxNews
National Women's Soccer League faces lawsuit as former employee alleges sexual assault,FoxNews
Tony Bennett in his own words: 'I feel that I have been truly blessed',FoxNews
"On this day in history, April 1, 1945, US forces invade Okinawa, last major battle of World War II",FoxNews
Esper replacement Chris Miller tells US troops: 'It's time to come home',FoxNews
"On Armed Forces Day, Honor Flight Network receives stunning donation from Mission BBQ",FoxNews
Thanksgiving casserole preferences vary state-by-state,FoxNews
,FoxNews
Balance of power: Trump campaign slams Sen Tester as 'radically out of touch' after abortion ad rollout,FoxNews
,FoxNews
Supreme Court rules in favor of Colorado graphic designer who refused to create same-sex wedding websites,FoxNews
,FoxNews
Virginia teacher shot by 6-year-old student in classroom says she'll 'never forget the look on his face',FoxNews
Shawn Mendes and Camila Cabello break up: We 'will continue to be best friends',FoxNews
"Kamala Harris, DNC undertaking 'largest gaslighting operation' in history of politics, says House speaker",FoxNews
"Illegal immigrants with 'terrorism ties' will continue to exploit border, Homeland Security report warns",FoxNews
,FoxNews
,FoxNews
"Analysis finds Americans need extra $11,400 to afford the basics as GOP lawmakers blame 'Bidenomics'",FoxNews
Matt Damon's advice to Josh Hartnett while filming 'Oppenheimer' was ‘so unhelpful’,FoxNews
"Former Secret Service agent warns agency ‘stretched thin’ with new responsibilities, lack of manpower",FoxNews
,FoxNews
,FoxNews
Jelly Roll gives powerful testimony to Congress on fentanyl: 'I was part of the problem',FoxNews
Video resurfaces of Harris chanting ‘down with deportation’ at 2018 parade with disgraced actor,FoxNews
"Thousands of anti-Israel protesters descend on White House praising Hamas, slamming 'genocide Joe'",FoxNews
,FoxNews
105-year-old woman graduates from Stanford University 83 years after leaving campus: 'Amazing',FoxNews
Fox News Poll: Trump has edge over Biden in potential 2024 rematch,FoxNews
"Meet the American who first recorded the blues, nation's original pop diva Mamie Smith",FoxNews
Full-scale replica of Anne Frank's hidden annex to be unveiled in New York City,FoxNews
,FoxNews
"From salmon to shark, here are the best and worst fish for your health, according to experts",FoxNews
White House calls communism a 'failed ideology' after historic Cuba protests,FoxNews
"Arizona grandma, man she mistakenly texted, to share Thanksgiving for 7th straight year since 2016",FoxNews
Tim Walz turns down NY Times interview requests about response to George Floyd riots,FoxNews
New York anti-Israel rally at UN features sign supporting terror group Hezbollah,FoxNews
,FoxNews
"Black farmers sue Biden administration over broken debt relief promise, say president reneged on meeting",FoxNews
,FoxNews
,FoxNews
RFK Jr. shrugs off Biden family corruption allegations: Won't be a 'spear tip to my campaign',FoxNews
,FoxNews
,FoxNews
,FoxNews
"Mike Rowe, well-known storyteller, announces 'Something to Stand For,' new film celebrating America",FoxNews
How to score cheap stuff (to keep or resell),FoxNews
Rural travel destinations where you can unplug and have fun this summer,FoxNews
Charlie Sheen's ex Denise Richards vows to ‘support’ their daughter Sami after actor disapproves OnlyFans page,FoxNews
Pentagon sending a ‘few thousand’ personnel to Middle East day after Biden said he wouldn’t add combat troops,FoxNews
,FoxNews
Top adviser to left-wing California DA charged with nearly a dozen felonies,FoxNews
"CNN boss, political director spiked Hunter Biden controversy, audiotapes reveal: 'We're not going with' story",FoxNews
"On this day in history, August 25, 1980, the Broadway musical '42nd Street' opens",FoxNews
Comedian Jim Gaffigan takes surprising shots at Harris for skipping 'Catholic Met Gala',FoxNews
Kamala Harris finally fields questions from press after dodging media for 18 days since becoming Dem nominee,FoxNews
Trump-Harris debate: Sen Rick Scott identifies 'biggest thing' that can help former president,FoxNews
,FoxNews
Supreme Court denies Biden administration appeal over federal emergency abortion requirement in Texas,FoxNews
10 gadgets to help you sleep better,FoxNews
"Pink slammed for wearing Biden-Harris shirt, husband Carey Hart comes to her defense: 'Bye Karen'",FoxNews
"Fox News Poll: Harris, Trump tied in Pennsylvania",FoxNews
,FoxNews
"Trump keeps massive lead, Haley ties DeSantis for second in new 2024 GOP presidential primary poll",FoxNews
Bernie Sanders to force Senate vote on resolution that could freeze aid to Israel,FoxNews
Sage Steele calls out Obama for 'scolding' Black men for lack of enthusiasm for Kamala Harris: 'Back off!',FoxNews
New drug for stiff person syndrome granted designation to speed up development: ‘Thrilled for the community’,FoxNews
Sydney Sweeney 'so glad' mother stopped her from getting breast reduction as a teen: 'They're my best friends',FoxNews
Longtime PA Dem silent on support for freshman 'Squad' member after his name is quietly removed from site,FoxNews
"Bruce Willis' daughter Tallulah gets emotional over photos with dad, 'my whole damn heart'",FoxNews
,FoxNews
Discovery of Civil War map sheds new light on Antietam’s bloody aftermath,FoxNews
,FoxNews
"On this day in history, July 26, 1990, President George H.W. Bush signs Americans with Disabilities Act",FoxNews
Paul Batura: Dick Hoyt's death – famed Boston Marathon runner and father lovingly pushed his son to greatness,FoxNews
Harris to virtually attend Catholic charity dinner that rival Trump is headlining,FoxNews
,FoxNews
,FoxNews
,FoxNews
Diabetes patients now have access to first generic GLP-1 medication: ‘More accessible and affordable’,FoxNews
Would-be Trump assassin Ryan Routh camped under cover of darkness for 12 hours: court docs,FoxNews
Politico alters headline calling Kamala Harris' support for banning fracking a 'Trump accusation',FoxNews
How long will the Kamala Harris honeymoon in the polls against Donald Trump last?,FoxNews
,FoxNews
Meta claims another 'error' after conservative college's second complaint about Facebook treatment,FoxNews
"This Veterans Day, four key lessons on leadership in America from a former Marine: 'Sense of mission'",FoxNews
Trump says he was 'shot with a bullet' in assassination attempt at Pennsylvania rally,FoxNews
,FoxNews
Flashback: Kamala Harris compared ICE to KKK in Senate hearing,FoxNews
New poll reveals Republican Senate candidate deadlocked with Dem in crucial deep blue state,FoxNews
Supreme Court overturns Roe v. Wade in landmark abortion decision,FoxNews
,FoxNews
Sydney Sweeney tackles Glen Powell affair rumors on 'Saturday Night Live',FoxNews
Hulk Hogan suggests he is willing to 'body-slam' US Vice President Kamala Harris,FoxNews
"Lori Loughlin, Mossimo Giannulli officially plead guilty in college admissions scandal case",FoxNews
NFL legend Troy Aikman rips 'lazy' Cowboys wide receivers after blowout loss,FoxNews
,FoxNews
Utah State is fourth school to forfeit women's volleyball match amid San Jose State trans player controversy,FoxNews
"Hurricane effects pose 'tremendous' health hazards for Americans, doctor warns",FoxNews
Ex-law enforcement officials warn Biden's menthol cigarette ban could 'create a vacuum' for Mexican cartels,FoxNews
,FoxNews
,FoxNews
,FoxNews
,FoxNews
Abandoned luxury hotel in Florida will reopen after 17 years,FoxNews
"Simon Cowell, Lauren Silverman engaged nearly 8 years after welcoming son",FoxNews
'I will be haunted forever’: Israel’s horrific video of Hamas atrocities leaves viewers shocked and sickened,FoxNews
Popular PA Democratic mayor warns Trump is ‘out-messaging’ Harris: 'I get more from Colbert',FoxNews
"On this day in history, September 23, 1806, Lewis and Clark return to St. Louis as heroes after journey",FoxNews
,FoxNews
Sean Payton's Broncos take advantage of depleted Saints roster in head coach's return to New Orleans,FoxNews
Former leader of Walz's battalion publishes scathing message aimed at governor's military career: Report,FoxNews
"Trump vows to cut business tax rate to 15%, create government efficiency commission led by Elon Musk",FoxNews
Jack Carr's take on the 1983 Beirut Marine barracks terror attack 40 years ago: 'Opening salvo in a new war',FoxNews
"FEMA has funds needed for 'immediate response and recovery,' despite Mayorkas' warning",FoxNews
,FoxNews
JD Vance on his 'change of heart' for Trump: Politicians shouldn't 'try to hide' from their past stances,FoxNews
Pennsylvania Republicans to draft bill to relocate migrants on Biden DHS flights to Delaware,FoxNews
"Trump arrives at Alabama-Georgia game to chants of 'USA,' 'Four more years'",FoxNews
Greece to impose tax for cruise visitors on popular islands to combat overtourism,FoxNews
"Missing Texas mom, luxury real estate agent seen in last photo before disappearance as family fears worst",FoxNews
John Kerry targets agriculture as part of climate crusade,FoxNews
,FoxNews
Delaware man stole $11K worth of cigarettes from Walgreens: state police,FoxNews
3 great American cities for history buffs and patriotic travelers this summer,FoxNews
"Harris-led office, ATF stonewalling probe into 'collusion' with anti-gun group lawsuit: House Oversight chair",FoxNews
"Intricacies of St Augustine, the oldest city in the United States",FoxNews
,FoxNews
Florida Supreme Court approves abortion ballot initiative while upholding 15-week ban,FoxNews
"Hurricane Helene wreaks havoc across Asheville, NC; National Guard deployed, 119 rescued",FoxNews
"Johnson grills DHS on migrant releases, as GOP pressure builds on border crisis",FoxNews
Who is Noa Argamani? Woman kidnapped by Hamas terrorists at trance music festival in Israel,FoxNews
Rep. Swalwell labels Trump-Vance ticket 'weird' and 'creepy' in line echoed by media: '24 karat creep',FoxNews
"Archbishop of Canterbury condemns gay marriage, but Anglican bishops remain divided",FoxNews
,FoxNews
CNN's Brian Stelter forced to address Cuomo sex scandal after network delayed coverage of first accuser,FoxNews
Taylor Swift announces new music after being scared by seemingly possessed piano during Eras Tour,FoxNews
"Louisiana classifies abortion drugs as controlled, dangerous substances after Gov. Landry greenlights proposal",FoxNews
Congress expected to consider emergency spending measure to replace Baltimore bridge after collapse,FoxNews
Biden to host virtual meeting with governors to 'protect women's reproductive health' after abortion ruling,FoxNews
Harris-Trump showdown: New polls indicate who has the edge in the Blue Wall battle,FoxNews
,FoxNews
"‘Oppenheimer’ stars Matt Damon, Emily Blunt on being neighbors and the one thing they'll never do together",FoxNews
"Oklahoma City outlaw biker boss jumped, killed nearly year to day after Texas gunfight",FoxNews
New York MS-13's 'Little Devil' convicted in ambush murder of 4 young men,FoxNews
Why JD Vance is concentrating on these 3 states: 'Red wall in November',FoxNews
Acting Secret Service director briefs lawmakers on Trump assassination attempt ahead of public report,FoxNews
Ask a doctor: ‘Why do I keep eating foods that I know are bad for me?’,FoxNews
,FoxNews
"North Carolina mom of 4 swept up by Hurricane Helene flooding in front of husband, 8-year-old son",FoxNews
Netanyahu says security in Gaza is critical to stop Hamas smuggling hostages into Iran: 'lost forever',FoxNews
WWE legend Hulk Hogan has Super Bowl aspirations for Lions after surprise camp visit: 'I predict greatness',FoxNews
,FoxNews
You’ll laugh at who MSNBC brought to whine about Trump’s alleged affair,FoxNews
Top New York Republican scorches state Dems' effort to ban gas stoves: 'An attack on working people',FoxNews
,FoxNews
Kamala Harris getting overwhelmingly positive media coverage since emerging as nominee: Study,FoxNews
'Tightest race since 2000': Harris-Trump showdown hits final stretch until Election Day,FoxNews
Tyra Banks defends Olivia Jade being on 'Dancing with the Stars' Season 30,FoxNews
Fetterman reams out NY Times for platforming terrorist propaganda after interview with senior Hamas official,FoxNews
,FoxNews
Reports of Biden White House keeping 'sensitive' Hamas intel from Israel draws outrage,FoxNews
Airline passenger's 'awkward' seating arrangement goes viral: 'Never going to recover',FoxNews
Biden admin's FEMA 'equity' plan faces backlash amid historic hurricane damage: 'What an embarrassment',FoxNews
,FoxNews
Trump plans to plead not guilty to Jack Smith's revised federal election interference charges,FoxNews
Sydney Sweeney is unrecognizable as she channels famous athlete for upcoming role,FoxNews
'Sickening': VP Harris slammed by school shooting victims' families over recently unearthed comments,FoxNews
Columbia University bars pro-Israel professor from campus for 'threatening behavior',FoxNews
,FoxNews
Kurt Cobain and Courtney Love attempted to escape 'craziness' of fame,FoxNews
,FoxNews
Honey Deuce sales at US Open revealed as cocktail explodes in popularity,FoxNews
,FoxNews
Mongolia ignores ICC demands to arrest Putin during state visit,FoxNews
Ex-NWSL coach slams league as 'woke' after being banned for life,FoxNews
Tren de Aragua members of violent Venezuelan migrant gang arrested in Texas: HSI,FoxNews
Meet the everyday heroes commemorated at FOX Nation's 2023 Patriot Awards,FoxNews
"'Distrust and chaos': Georgia Dems, GOP battle over new ballot rule as early voting kicks off Tuesday",FoxNews
,FoxNews
Vance vs. Walz: Think VP debates don't matter? Just look at these 6 examples,FoxNews
,FoxNews
"Trump-Harris presidential debate: Philadelphia under Biden saw cops, kids shot, alleged savage offenders freed",FoxNews
"Harris re-energizes Black voters in key states, poll finds",FoxNews
"On this day in history, Sept. 16, 1620, Mayflower departs Plymouth, England",FoxNews
Biden shrugs off age concerns during friendly Seth Meyers chat: 'It's about how old your ideas are',FoxNews
Biden's move to lift financial restrictions on notorious dictatorship triggers backlash,FoxNews
Justice Ketanji Brown Jackson asks tough questions in first Supreme Court oral argument,FoxNews
Former Colorado apartment resident says Gov. Polis 'wouldn't last five minutes' against armed gangs,FoxNews
"App crash during Lent leads Hallow CEO to hear God say, ‘Give up and let me handle it’",FoxNews
FBI has gained access to Thomas Matthew Crooks' phone in Trump assassination attempt,FoxNews
Stiff person syndrome patients share what it’s like to live with the rare disease,FoxNews
9/11 survivor recounts haunting escape from 81st floor of World Trade Center tower,FoxNews
"Bruce Willis, Demi Moore and Arnold Schwarzenegger, Maria Shriver still have ‘forever’ relationships",FoxNews
"Health care is ‘overwhelmingly complex’ for older adults, experts say: ‘Ever-increasing hurdle’",FoxNews
Top Republican demands Biden admin block Iranian foreign minister's visit to UN: 'an insult' to victims,FoxNews
Lexi Thompson reflects on 'emotional week' playing for USA for likely last time at Solheim Cup,FoxNews
"Trump-Harris race neck and neck nationally in new survey, pollster sees 'warning sign' for Dems",FoxNews
Schumer calls for new Israeli leader to replace Netanyahu in Senate floor speech,FoxNews
"'Pay for slay': Palestinian Authority may have to compensate families of Hamas terrorists, report says",FoxNews
"Biden admin eco rule curbing oil drilling, mining faces widespread opposition",FoxNews
,FoxNews
,FoxNews
"WWII vet, 101, 'finally' walks at graduation 80 years after having to miss ceremony amid global war",FoxNews
"'Euphoria's' Sydney Sweeney faces heat for mom's party featuring MAGA-like hats, 'Blue Lives Matter' shirt",FoxNews
,FoxNews
"Border crisis overwhelming officials, communities as migrant numbers keep surging",FoxNews
,FoxNews
,FoxNews
Sen. Tammy Baldwin repays taxpayer-funded November 2020 NYC trip to see partner,FoxNews
Farmers sound alarm on Biden admin's agriculture policies: We're 'not doing well',FoxNews
,FoxNews
DeSantis touts Florida lawsuit seeking to block Biden's Title IX changes,FoxNews
"Before there was Veterans Day, there was Armistice Day",FoxNews
Anti-Israel mob rebrands iconic Hamilton Hall following insurrection at Columbia,FoxNews
"Bill Maher: Trump is 'right' about the dangerous rhetoric aimed at him, 'but he is a threat to democracy!'",FoxNews
11 monumental Kentucky Derby moments from years past,FoxNews
Kamala Harris' campaign criticizes Trump for serving 'self-obsessed rich guys' after interview with Elon Musk,FoxNews
Lake rips Biden-Harris 'double whammy' policies affecting Arizonans : 'Driven us over the cliff',FoxNews
,FoxNews
,FoxNews
,FoxNews
New York Republican co-sponsors bill defending IVF treatment,FoxNews
Hispanic voters rail against 'dishonest' Biden-Harris border record as poll shows Trump gaining in key states,FoxNews
First and potentially only presidential debate between Harris and Trump being held in crucial battleground,FoxNews
Historical time capsule containing letter from President Coolidge unveiled at National WWI Museum,FoxNews
"Russia says Ukrainian intel chief responsible for Crimea bridge attack, increasing assassination risk",FoxNews
,FoxNews
Tennessee school shooting: What to know about Covenant School in Nashville,FoxNews
Kentucky Derby 2023: What to know about the first leg of horse racing's Triple Crown,FoxNews
,FoxNews
"Harris finally adds policy page to campaign website, devotes several sections to Trump",FoxNews
Kamala Harris' latest word salad honors 'women who made history throughout history' for Women's History Month,FoxNews
Planning a 2-week vacation getaway? Experts say workers should think again,FoxNews
