headline,source
Are noise-canceling headphones hazardous to your health? Audiology experts share warnings,FoxNews
"Beyoncé gave SCOTUS Justice Ketanji Brown Jackson concert tickets valued at nearly $4,000: report",FoxNews
Supreme Court hears cases on prolonged detention of illegal immigrants,FoxNews
"Texas mom, luxury real estate agent missing after party at exclusive private club, husband arrested",FoxNews
,FoxNews
'Top Thrill 2' roller coaster at Cedar Point will not reopen this season,FoxNews
'Airport tray aesthetic' goes viral as some travelers halt security checkpoints for photo ops,FoxNews
New poll shows Trump holds lead with ‘remarkably resilient’ support,FoxNews
Alert St. Louis hotel staff helps save kidnapped Florida women from captors: report,FoxNews
Biden admin's proposed menthol cigarette ban could become liability in 2024: 'Unintended consequences',FoxNews
First on Fox: Top outside group backing Senate Republicans showcases fundraising haul,FoxNews
Eye spy a big problem: California doctor removes 23 contact lenses from one woman’s eye,FoxNews
"Trump has taken 81 questions at press conferences, interviews compared to Harris' 14 since Walz joined ticket",FoxNews
Mother of migrant crime victim angered over VP Harris' answers: 'She does' owe us an apology,FoxNews
,FoxNews
Former One Direction band member Niall Horan announces new solo music and festivals in 2023,FoxNews
"Picky eater in your family? Try using a different color of dishware, study suggests",FoxNews
North Carolina community 'hunting' for missing teachers in 'devastating' aftermath of Hurricane Helene,FoxNews
,FoxNews
Vandals deface tour bus for women's advocacy group with 'anti-woman messages',FoxNews
3 workers remain hospitalized after collapse of closed bridge in rural Mississippi killed co-workers,FoxNews
,FoxNews
"Michigan State sets aside 'Unconditional Love Fund,' but only 'LGBTQIA2S+' students are eligible",FoxNews
Webpage that rated Kamala Harris the 'most liberal' senator in 2019 suddenly disappears,FoxNews
"'Warning signs flashing': Biden, Trump struggle to lock up base voters ahead of first debate",FoxNews
Anti-Israel demonstrations continue near DNC for 3rd night as crowds gather in larger numbers,FoxNews
,FoxNews
Food at college gets high-tech boost with first robotic kitchen in university setting,FoxNews
The Washington Post wages war on Elon Musk as he takes over Twitter,FoxNews
'Kamala Era': DNC launches Taylor Swift-themed campaign in pitch to young voters,FoxNews
Secrets of staying ageless: Four Florida seniors reveal how to hit a home run for good health,FoxNews
,FoxNews
Liam Payne’s One Direction bandmate shares ‘heartbreaking’ final moments together in Argentina,FoxNews
Bill Maher roasts woke 'presentism': 'A magic moral time machine' where you always win,FoxNews
"Trump opposes Florida's Amendment 4, which offers unfettered abortion access: 'It's radical'",FoxNews
"Latinos shifting to Trump because they have 'internalized racism,' journalist claims",FoxNews
,FoxNews
Former Bernie Sanders staffer torches his Biden endorsement and warns of Trump's appeal: 'Where've you been?',FoxNews
"Fox News Poll: Harris, Trump locked in tight race in battleground Pennsylvania",FoxNews
California sues beach city over voter ID law backed by majority of residents,FoxNews
Who is Tim Walz? Meet the Harris running mate who called Republicans 'weird people',FoxNews
,FoxNews
,FoxNews
"National Museum of the Marine Corps unveils new exhibits, honoring those 'who made the ultimate sacrifice'",FoxNews
WSJ editorial board says Harris is doing first interview with 'crutch' Tim Walz: ‘Insult to American voters',FoxNews
Fix autocorrect if it’s driving you ducking crazy,FoxNews
,FoxNews
,FoxNews
"Migrant controversy hits heartland as Alabama council meeting boils over, state officials slam feds' 'mess'",FoxNews
"Harris, Trump camps launch dueling ad blitzes to define VP for voters",FoxNews
"Laken Riley murder suspect Jose Ibarra pleads not guilty, mother sobs in court",FoxNews
"Zuckerberg, expressing regrets, admits bowing to Biden administration pressure to remove content",FoxNews
Trump previews closing arguments in 'sham trial': 'Very dangerous day for America',FoxNews
"Jimmy Carter’s family reveals how president felt about Biden quitting, which DNC speaker stole the show",FoxNews
,FoxNews
'The epicenter': How 'key' to White House could lie in suburban Georgia county,FoxNews
"Ozzy Osbourne cancels all tour dates amid 'life-altering' injury, several health scares",FoxNews
"On this day in history, August 10, 1776, Declaration of Independence reaches London",FoxNews
Trans inmate who killed baby and identifies as Muslim woman sues chaplain for allegedly not allowing hijab,FoxNews
Biden cancels overseas trip as Milton bears down on Florida; DeSantis tells VP 'it's not about you Kamala',FoxNews
"Harris, Trump, hold dueling campaign events in race to win the biggest battleground",FoxNews
"Ivy League anti-Israel agitators' protests spiral into 'actual terror organization,' professor warns",FoxNews
,FoxNews
Kamala Harris should have been 'pushed harder' on Biden's mental fitness during interview: WaPo columnists,FoxNews
,FoxNews
Senate Dems line up in favor of spiking Biden's Chinese solar handout,FoxNews
"Israeli ministers frustrated over US, IDF leak on Lebanon operation: Report",FoxNews
Special Counsel Jack Smith hits back at judge for 'fundamentally flawed legal premise' in Trump documents case,FoxNews
,FoxNews
10 most patriotic US states for July 4: See if your home state made the list,FoxNews
Reporter 'visibly shaken' after CNN boss scolds him for being 'too emotional' in Trump town hall coverage,FoxNews
,FoxNews
,FoxNews
Biden donors 'freaked out' by his reliance on teleprompters at private fundraisers,FoxNews
,FoxNews
,FoxNews
"Political storm: On Trump 'onslaught of lies,' Biden urges former president to 'get a life man'",FoxNews
"Puppies rescued from Hurricane Helene to be rehomed with military veterans, first responders",FoxNews
,FoxNews
"Women's pro soccer league had systemic abuse and sexual misconduct, investigation reveals",FoxNews
NRSC launches funds to give Republican Senate candidates a 'war chest' for key 2024 Senate races,FoxNews
McConnell: Schumer afraid a Title 42 amendment to COVID spending would've passed with Democratic votes,FoxNews
"Biden 'doesn't understand the Catholic faith,' bishop says: 'I'm not angry at him, he's just stupid'",FoxNews
Sleep through the night with these 5 viral bedroom finds,FoxNews
,FoxNews
Secret Service Director Kimberly Cheatle reacts to independent review of Trump assassination plot,FoxNews
"White House warns of 'ultra-MAGA' policies, abortion ban if GOP takes majority in Congress",FoxNews
MSNBC guest claims Latinos 'want to be White' while discussing their shift toward GOP,FoxNews
,FoxNews
These Florida residents wouldn't evacuate from Milton - here's how they're doing,FoxNews
"Sen. Joe Manchin calls on Biden to step aside, pass torch to 'a new generation'",FoxNews
,FoxNews
New York AG case against NRA leader faces trial after court again rejects gun group's claim of political probe,FoxNews
,FoxNews
,FoxNews
Texas officials: Uvalde shooting report reveals 'multiple systemic failures',FoxNews
IDF uncovers massive smuggling tunnel for vehicles on Gaza-Egypt border,FoxNews
'Beyond Insane': Economists slam Biden-Harris proposal to tax unrealized investment returns,FoxNews
Secretary of State Blinken arrives in Israel in show of solidarity following Hamas terrorist attacks,FoxNews
,FoxNews
,FoxNews
,FoxNews
Sydney Sweeney says the backlash from her mom's MAGA-like birthday party décor was 'wildfire',FoxNews
Simon Cowell details yearslong mental health battle: 'We're not all made of steel',FoxNews
Men’s energy and vitality plummets for 6 reasons. Boost it back up this way,FoxNews
Biden pledges $7.3B in 'clean energy' spending with national debt at $35T,FoxNews
Search for missing Texas mom Suzanne Simpson leads to San Antonio landfill,FoxNews
,FoxNews
Sen. Ron Johnson releases preliminary findings of probe into Trump assassination attempt,FoxNews
Riley Gaines on NCAA lawsuit: 'It is time that we fight back',FoxNews
Reservations for election week getaway sell out in seconds as 'unplugged' travel spot offers steal of a deal,FoxNews
"Trial for Delphi, Indiana murder suspect moved up to May",FoxNews
Pennsylvania leaders in both parties talk ground game as GOP seeks to undo Dem gains: 'Massive shift',FoxNews
,FoxNews
"Trump shooting site gives bird's-eye view of 'disorganized' rally scene, witnesses say",FoxNews
"On July 4, 'remember the blessing of living in the most free and prosperous society' on Earth",FoxNews
"Armed Services Republicans, White House push back against claims that Zelenskyy's PA visit was 'political'",FoxNews
CNN data expert says Harris' momentum has 'stalled' while Trump is more popular than in past elections,FoxNews
"Nearly 20 years since 9/11 terror attacks, first FDNY chief on scene honors 'Ordinary Heroes'",FoxNews
Mystery food bags bought at Whole Foods on deep discount go TikTok viral: 'Hit or miss',FoxNews
,FoxNews
,FoxNews
"Five controversies surrounding vice presidential nominee Tim Walz, from DUI to COVID fraud",FoxNews
"RFK Jr has ‘no business’ testifying in Congress on government censorship, Democrats say",FoxNews
"Kamala Harris supported ‘Defund the police’ in 2020 radio interview, before Biden campaign said otherwise",FoxNews
"Kids may like video gaming, but health experts fret about the 'fuel' they may be using to 'win'",FoxNews
3 security and data checks you should do once a year,FoxNews
,FoxNews
Nelly Korda suffers unbelievable meltdown at US Women's Open with early septuple-bogey,FoxNews
"Third parties are like 'cockroaches in the kitchen,' former Clinton adviser says: 'Foul it up' for Biden",FoxNews
,FoxNews
Harris' 'word salad' answer on Israel alliance confounds social media users: 'Someone please interpret',FoxNews
,FoxNews
Brian Stelter remains defiant as final 'Reliable Sources' doubles down on what critics say got it canceled,FoxNews
"5 egg myths dispelled by an expert, plus tips for every egg lover",FoxNews
Delphi murders trial: Suspect Richard Allen's attorneys make stunning revelation about hair at crime scene,FoxNews
Trump assassination attempt: Fraternal Order of Police blasts Secret Service 'failure',FoxNews
,FoxNews
Candy tours of America: 5 delectable destinations for sweet family memories,FoxNews
Biden mistakenly touts his '2020 agenda' during Seth Meyers interview,FoxNews
Far-left hatred of Jews today echoes the socialism and antisemitism of Hitler in the 1930s,FoxNews
Family that lost 11 in Hurricane Helene mudslides says community sacrificed 'life and limb' to save each other,FoxNews
Sources close to Biden 'furious' about growing calls to get him to exit race: report,FoxNews
Christian baker sued for refusing gender-transition cake says Supreme Court ruling puts law on his side,FoxNews
3rd-strike 'trans' rape suspect prompts rebellion against CA law after attack in women's prison,FoxNews
,FoxNews
Dems mocked as ‘low-T soy boys’ after CNN anchor says DNC appeals to opposite of 'testosterone-laden men',FoxNews
,FoxNews
Ask a doctor: 'How can I prevent high cholesterol?',FoxNews
,FoxNews
,FoxNews
Texas Supreme Court rejects challenge to state abortion ban's medical exceptions,FoxNews
Bears legend Dick Butkus takes shot at Packers' Aaron Rodgers after getting verified on Twitter,FoxNews
Campaign crisis: Dems who have called for Biden to drop out or raised concerns about his health,FoxNews
,FoxNews
Rock & Roll Hall of Fame Foundation moves forward with Dolly Parton's nomination despite icon's opposition,FoxNews
Sydney Sweeney rips internet trolls for tagging family in screenshotted nude scenes: ‘Disgusting’,FoxNews
,FoxNews
Idaho prosecutors reject student murders suspect's longshot bid to have death penalty taken off table,FoxNews
Pat Sajak staying on as board chair of conservative Hillsdale College,FoxNews
VA Tech swimmer rips NCAA transgender participation policy: 'Feels like the final spot was taken from me',FoxNews
,FoxNews
Biden's EPA has coordinated with left-wing eco groups tied to liberal dark money network,FoxNews
Iran fires multiple missile strikes across Israel,FoxNews
Bob Dylan museum opening in Tulsa,FoxNews
"Biden questioned on migrant surge, says 'not rational' to 'send them back' to Venezuela, Cuba, Nicaragua",FoxNews
Rosh Hashanah prompts Museum of the Bible to display oldest Jewish book in the world,FoxNews
Bruce Willis' daughter says he's shown her 'to not take any moment for granted': 'There's painful days',FoxNews
"Kamala Harris has 'rabbit ears' for any 'hint of criticism,' frustrating Biden White House: book",FoxNews
,FoxNews
America the beautiful: 50 must-see landmarks that tell our national story,FoxNews
Trump-Vance ticket has done combined 105 interviews since August compared to 103 for Harris-Walz,FoxNews
"Nearly 200 GOP lawmakers blast Biden's EPA for targeting farmers, ranchers: 'Egregious federal overreach'",FoxNews
,FoxNews
,FoxNews
Trans child molester sentenced for killing friend with a rock in fight over $100,FoxNews
Harris does interview with raunchy sex and relationship podcast as she continues to avoid many news outlets,FoxNews
"Anti-Israel agitators shut down traffic, disrupt cities all across US in demand for Gaza cease-fire",FoxNews
"Blind Michigan judge drives race car — and inspires others to follow their dreams, too",FoxNews
Colorado could become the first state to build separate prison units for transgender felons,FoxNews
,FoxNews
Schumer-backed border bill fails a second time with even less Dem support,FoxNews
,FoxNews
,FoxNews
Christmas trees are just one part of the allure that a Vermont family brings to NYC each December,FoxNews
,FoxNews
,FoxNews
Trump stages Mar-a-Lago press conference in 'stark contrast' with Harris as she avoids media,FoxNews
"Americans favor Trump on immigration, support mass deportation of illegal immigrants, poll finds",FoxNews
NBC reporter calls out Kamala Harris for saying her 'values haven't changed': 'Her positions have changed',FoxNews
Harris calls for eliminating filibuster to pass 'Roe' abortion bill into federal law,FoxNews
Opinion: Biden’s Title IX rule adds discrimination against women through the backdoor,FoxNews
FLASHBACK: See how Kamala Harris answered when she was confronted in 2020 as 'the most liberal senator',FoxNews
$1 rum cocktail at Applebee's highlights Halloween-themed drink deals,FoxNews
4 horses have died at Churchill Downs ahead of 149th Kentucky Derby,FoxNews
,FoxNews
'Elvis' takes No. 1 after tie with 'Top Gun: Maverick',FoxNews
"On this day in history, March 1, 1872, majestic Yellowstone becomes America's first national park",FoxNews
Pat Mahomes Sr pleads guilty to DWI 3rd time or more charge,FoxNews
Web designer's victory at Supreme Court is free speech win for all,FoxNews
Kari Lake shreds VP Harris' 'despicable' southern border visit: Just to make the 'mainstream media happy',FoxNews
"Meet the American who founded the American Legion, Theodore Roosevelt Jr., privileged to fight and to serve",FoxNews
"'Out of money': Whistleblowers allege lack of Secret Service funds, delayed payments, top senator reveals",FoxNews
Lauren Boebert won't 'further imperil' slim GOP majority by running in special election for Ken Buck's seat,FoxNews
What happens now that Supreme Court struck down Biden's student loan handout scheme,FoxNews
,FoxNews
"'That is a fraud': Gov. DeSantis calls out Lia Thomas, biological men competing in women's sports",FoxNews
,FoxNews
Have battlegrounds shifted with Harris at top of ticket?,FoxNews
Republican John Duarte wins House race in California's 13th Congressional District,FoxNews
,FoxNews
Trump guilty on all counts in New York criminal trial,FoxNews
'The biggest challenge right now is fuel': Rep. Greg Steube of Florida talks hurricane aftermath,FoxNews
Local officials face off against Georgia's elections board over rule that could shake up November,FoxNews
Sen. Fetterman hits back at AOC's suggestion he's a bully after House clash: 'That's absurd',FoxNews
,FoxNews
"Fox News Poll: Majorities approve President Biden dropping out of 2024 race, but don’t think he should resign",FoxNews
,FoxNews
"Fox News Poll: Trump leads Biden in Georgia, receiving just over 50% support",FoxNews
Maher rips rapper's profanity-laced tirade against USA: ‘Sure it was a big hit with the Queers for Gaza crowd',FoxNews
Tina Turner teams up with Kygo for 'What's Love Got to Do With It' remix,FoxNews
Mudslinging candidates in heated House race face voters on big primary day,FoxNews
Blood tests for Alzheimer's may be coming to your doctor's office: What to know,FoxNews
Not Minnesota nice: GOP congressman playing Tim Walz in debate prep with JD Vance argues he's an 'empty suit',FoxNews
,FoxNews
Tensions allegedly rise between Biden White House and Harris campaign: 'Too much in their feelings',FoxNews
,FoxNews
NRA leaders knock back liberal pols 'who want to exaggerate our death': 'We haven't lost a beat',FoxNews
,FoxNews
SJSU women's volleyball player praises Nevada team for raising concerns about playing vs trans opponent,FoxNews
Kamala Harris offers vague 'Day 1' Oval Office plan in CNN interview: 'A number of things',FoxNews
Democrats worry about Harris' cautious media approach in tight 2024 race: 'Voters deserve better',FoxNews
Fox News Power Rankings: The frontrunner and contenders in the 2024 GOP primary field,FoxNews
,FoxNews
Weird ways to burn calories: Health experts reveal habits that don't include sweat sessions at the gym,FoxNews
,FoxNews
,FoxNews
"Florida, Oklahoma instruct schools to ignore Biden's Title IX changes, pending legal challenges",FoxNews
"Trump assassination attempt suspect laughs, smiles during first court appearance in Florida",FoxNews
"Harris campaign is in 'danger zone' as Americans worry about country's direction, says CNN data guru",FoxNews
Bill Maher hypes Taylor Swift's endorsement of Kamala Harris: She has 'saved democracy',FoxNews
"Skipping the Super Bowl sit-down twice, Biden continues months-long streak of avoiding serious news interviews",FoxNews
Voters react to Vance 'non-answer' when asked if Trump won 2020 election,FoxNews
FLASHBACK: CNN's Brian Stelter claimed Chris Cuomo upheld journalistic 'boundaries' during Colbert interview,FoxNews
"Bear meat for dinner? Follow these steps to prevent parasitic infection, CDC says",FoxNews
"On Veterans Day, this Vietnam vet wants others to know: ‘You are not alone’",FoxNews
,FoxNews
Luke Bryan’s son surprised Katy Perry with a very odd question for his dad,FoxNews
'American Idol' fans criticize Katy Perry and Luke Bryan after 'rude' reaction: They need to 'apologize',FoxNews
America's military and veterans with PTSD have a fighting chance to heal,FoxNews
"NJ teen stabbed at popular boardwalk, 'civil unrest' hits another beach town",FoxNews
,FoxNews
"Trump spars with Harris, moderators during heated presidential debate: 'She doesn't have a plan'",FoxNews
"Jake E Lee, former guitarist for Ozzy Osbourne, shot multiple times in Las Vegas",FoxNews
,FoxNews
Emergency landing prompts United Airlines pilot to order dinner for 150 passengers,FoxNews
"July Fourth blessings on America, with lessons from the red, white and blue",FoxNews
,FoxNews
Biden shredded after issuing first veto of his presidency to protect ESG: 'Such a liar',FoxNews
"Timeline of 2nd failed assassination attempt on Donald Trump; suspect Ryan Routh developed rage, radicalism",FoxNews
,FoxNews
"Researchers argue 'rapid onset gender dysphoria' does exist, despite narrative against it",FoxNews
High school students have a strong shot at success with career technical education: 'A win-win',FoxNews
"CNN changes: From Chris Cuomo to Brian Stelter, it’s been a wild year for scandal-plagued network",FoxNews
Morning Glory: Why is Kamala Harris skipping the Al Smith Dinner in New York City?,FoxNews
,FoxNews
"Hundreds of rural hospitals are in danger of shutting down, study finds: ‘At risk of closure'",FoxNews
Nicholas Sparks' chicken salad recipe leaves fans upset over secret ingredient: 'Gone too far',FoxNews
,FoxNews
"Michigan Democrats, community leaders sound alarm bells after thousands of voters protest Biden in swing state",FoxNews
Top House committee ramps up pressure to obtain 'important' docs on Harris' role in border crisis,FoxNews
Harris barnstorms Wisconsin in 1-day swing state tour targeting young voters,FoxNews
Bruce Willis' first photo as grandpa with Rumer Willis’ baby girl: ‘Something I will treasure’,FoxNews
"Camila Cabello suffers Met Gala wardrobe malfunction, exposing underwear",FoxNews
Britons cast their votes in heavily-anticipated UK parliamentary election,FoxNews
,FoxNews
"'Gargantuan' butcher-block wavy flag is a quarter-ton testament to power of patriotism, land of opportunity",FoxNews
'Bold agenda': 2024 GOP rising star promises to crack down on schools turning kids into their 'guinea pigs',FoxNews
Turkey's Erdogan threatens to invade Israel over war in Gaza as regional tensions grow,FoxNews
Supreme Court rules in favor of NRA in key First Amendment case,FoxNews
Lawmakers berate Mayorkas on Laken Riley murder: ‘Your policies in action’,FoxNews
,FoxNews
White House repeatedly dodges on if Biden thinks Netanyahu is an 'obstacle for peace:' 'Not answered 3 times',FoxNews
,FoxNews
Kamala Harris guarantees reelection in 2024 after asked why Biden's not '30 points ahead' of Trump,FoxNews
,FoxNews
IDF reveals 4 reasons why it killed Hezbollah commander Fuad Shukr,FoxNews
"Bradley Cooper supports Brad Pitt, Brooke Shields as real-life Hollywood hero",FoxNews
Biden endorses Kamala Harris after bowing out of 2024 race,FoxNews
"Girls killed in Delphi murders were sacrificed in pagan cult ritual, defense claims",FoxNews
Former US ambassador accused of secretly working for Cuba pleads not guilty,FoxNews
'The View' host attacks Brittany Mahomes for indicating support for Trump: 'She's in an interracial marriage',FoxNews
"11 tips for adults age 65 and over to ‘live well’ over time, according to gerontologists",FoxNews
,FoxNews
"California crime reform gets 'unheard of' support from DAs, small businesses, progressive mayors",FoxNews
,FoxNews
"Biden's latest border order may embolden migrants to flout immigration laws, commit marriage fraud",FoxNews
,FoxNews
"CNN's Christiane Amanpour calls out boss Chris Licht, offers stunning rebuke of Trump town hall",FoxNews
"North Carolina sheriff hunting 'Christmas Day Killer' knows him personally, warns he has 'nothing to lose'",FoxNews
Army veteran regains ability to walk with robotic exoskeleton after paralysis: ‘Beyond words’,FoxNews
Kamala Harris' presidential campaign raises nearly $50 million since Biden endorsement,FoxNews
"As Gaza war drags past 1 year mark, hope fades for a deal to bring hostages home soon",FoxNews
Rogan says Dems are terrified criticizing Biden will 'empower' Trump so they're 'just lying to everyone',FoxNews
"Biden repeats false claim about trips to Iraq and Afghanistan, this time to graduating midshipmen",FoxNews
,FoxNews
USA Today under fire for allowing Stacey Abrams to retroactively edit op-ed to downplay boycott support,FoxNews
"White House says Trump’s tariffs will destroy manufacturing, exacerbate inflation",FoxNews
"Why Jimi Hendrix’s death at 27 is still shrouded in mystery, book reveals: ‘It was an avoidable accident’",FoxNews
Riley Gaines rips Georgia Tech president in remarks to lawmakers: 'Why didn’t you protect me?',FoxNews
Trump team calls out Walz for ‘weird flex’ after veiled Vance reference at DNC,FoxNews
Trump assassination attempt: Why Florida prosecutor says ‘insanity’ defense won’t stick for suspect,FoxNews
'Thrilled to endorse': Conservative super PAC unleashes 7-figure push for early voting in key Senate race,FoxNews
Republicans probe CCP-tied nonprofit funneling money to US eco groups,FoxNews
Los Angeles County DA releases Menendez brothers letter cited as 'new evidence' that sparked review of case,FoxNews
South Korean intelligence says North has sent troops to aid Russia’s war in Ukraine,FoxNews
,FoxNews
"MSNBC's Nicolle Wallace gushes over Biden in rare live interview, avoids growing Hunter scandal",FoxNews
,FoxNews
Hamas billionaires: Lifestyles of the rich and terrorists,FoxNews
Summer vacation ideas while there's still time: Here are 6 smart spots to consider,FoxNews
Three Harris DNC attack lines against Trump that were inaccurate or false,FoxNews
"On this day in history, January 8, 1790, George Washington delivers first-ever State of the Union address",FoxNews
"Meet the American who taught the Tuskegee Airmen to fly, pioneer pilot Charles 'Chief' Anderson",FoxNews
"Tim Walz, Kamala Harris' new right-hand man, echoes left-wing crime policies",FoxNews
"Pennsylvania court tosses school mask mandate, health secretary appeals",FoxNews
Politico says Harris is running on a 'dream economy' but voters aren't noticing,FoxNews
"Watch out: Biggest data breaches of 2024, so far",FoxNews
"Yazidi woman held hostage for 10 years in Gaza rescued in Israel, US operation",FoxNews
Sen Chuck Grassley explains link between high food and energy prices,FoxNews
,FoxNews
Biden's border policies would likely be extended if this swing state Dem governor is the new nominee,FoxNews
CMA nominee Jelly Roll says troubled past empowered him to succeed: 'I was a horrible human for decades',FoxNews
Gretchen Whitmer rejects polls showing Harris up 5 points against Trump in Michigan: 'It's just not true',FoxNews
"On this day in history, September 17, 1937, Abraham Lincoln carving is officially dedicated at Mount Rushmore",FoxNews
"Walz's lack of media exposure hurt him in debate, commentators admit: 'Out of practice'",FoxNews
FEMA head denies agency is short on money for disaster relief because funds went to illegal immigrants,FoxNews
,FoxNews
